character,line
Hunter,What the hell's happening?
Hartley,I can't let go! Aah!
May,"Okay, Hartley, just relax your hand."
Hartley,I can't let go. Don't touch it. Just stay away.
Skye,They'll be on us any second.
Hunter,"Okay, time to go. Help me get her up. Can you walk?"
Hartley,I think so.
Hunter,What are you waiting for?! We need to get her out of here before we all get killed! We got what we came for!
May,Not everything we came for.
Hunter,Wait. What are you talking about?
Skye,"Coulson, Hartley has the item, but it's attacking her. She needs medical right now. Do we abort?"
Billy Koenig,Alarms have sounded. Chances of them being captured or killed here just skyrocketed.
May,Should we just cut our losses? Coulson?!
Hunter,Come on! Come on!
Skye,"S-sir, I repeat... what are our orders? Do we go dark?"
Coulson,Negative. Do not abort. Proceed as planned.
May,You heard him.
Hartley,Help me up. I can follow.
Hunter,Are you mental?
Hartley,We have our orders.
Hunter,Screw the orders. We need to get you to a doctor.
Skye,Hunter...
Hunter,"No, no, stay here and die if that's what you want to do, but I'm making sure she doesn't. I wish you the best of luck, really, but we're out of here."
Triplett,Go! Go!
Man,They're headed to the West door!
Hunter,Get us the hell out of here!
Idaho,You got it.
Hartley,Cut it off.
Hunter,What? N-no. Okay? We'll get you to a hospital. They'll fix this.
Hartley,"This thing is killing me. I can feel it. I need you to cut it off, or I won't make it to the hospital. It's no big deal. You've seen what they can do with robotics these days."
Hunter,"Uh, probably be an upgrade."
Hartley,I don't want to die.
Hunter,Okay.
Coulson,"I know it was a risk. If we went down today, we'd probably be down for good. But now we have a chance to survive. We have soldiers willing to sacrifice, but they need weapons. The enemy has the advantage. We need one of our own."
Mack,You risked that for a quinjet?
Coulson,"No. For what we can do with one. Disappear. Become ghosts. That's how we have to live now... in the shadows, to save people, even when they don't know it, don't want it. Fitz said he could engineer cloaking, but... I'm afraid he can't do anything. The damage to his temporal lobe was too extensive. He's not the same, and... since Simmons left, he's only getting worse."
Fitz,"And this is number two of five. But if we get this one finished today, there's not much... Simmons, I said not to touch anything. Yes, yes. I know. I know. And I have told them to be patient, like you said, but I'm still having trouble communicating the... the ... yes. Thank you. Sorry."
Coulson,"Simmons said she thought he'd be better without her here, but her leaving just broke him. In the months since, he's grown isolated, talking to himself more and more."
Fitz,I know. I know. I'm almost there.
Coulsoon,"We have to fight on for him, for those we've lost. We have to take risks... so the sacrifices they made were not made in vain. And then... we'll disappear."
Bakshi,"Creel has escaped and did indeed make off with the Obelisk. He should contact us shortly. I would have him come in, but I'm being overly discreet with this operation. I know how long you have been searching for this, Dr. Whitehall."
Whitehall,You have no idea.
