character,line
Coulson,"This one is not. It's real, with real bullets. So you better put yours down and tell me what the hell's going on right now."
May,I...
Coulson,Now!
May,I can't.
Skye,"You better listen to the man, Agent May."
May,You have no idea what you're doing.
Skye,Maybe not. But I know you're not fast enough to take us both.
May,Look... I can explain everything. But not here.
Coulson,"Why not here? You have to check with someone first, using that encrypted phone in the cockpit? Who's on the other end of that line, May?"
May,I can't say.
Coulson,"That's okay. I think I know. It makes sense now why Deathlok put Blake in critical condition, left you alive and well, why he led us to the track only to disappear... instead of defending his boss. Why would he do that? Because that wasn't his boss, was it? Was it?!"
May,What are you talking about?
Coulson,Stop lying to me! Who do you answer to?! Who's the real Clairvoyant?!
May,Wha...?
Coulson,What did you do? Where are we going?
May,"I don't know! I didn't do it, Phil! I don't know what's happening here, I swear!"
Coulson,"If you're not doing this, who is?"
Hand,"When that plane touches down, take out everyone on board. Except Agent Coulson. He's mine."
