character,line
Davis,She's reckless and dangerous!
Piper,She deliberately disobeyed your orders.
Davis,"She seriously compromised our chances of getting home. We are almost out of food, and we don't even know how many more jumps we can make."
Piper,We need to confine her to the cargo hold. She put our lives and the mission at risk.
Simmons,Fitz is the mission. We didn't come this far to give up. Cowards.
Daisy,"Enough. Everybody stand down and take a breath. Simmons is right. Fitz is the mission. But I'm the mission leader, and that was my call to make, not yours."
Simmons,Whose side are you on?
Daisy,"You know damn well whose side we are all on. We went to a Fire Planet for you. We followed every bread crumb trying to find him, and now we're at the end of a galaxy because of a tiny word we can't even read."
Simmons,I told you what it said!
Daisy,"We need to take a step back, Jemma. We can't save Fitz if we can't save ourselves. We're going home. Hopefully we can make it there."
Simmons,"Go if you want, but I'm staying."
Daisy,"Permission denied. And if you have a problem with that, I'll have you locked up until we get there."
Simmons,I'd like to see you try.
Piper,What was that?
Pryce,"Greetings. Welcome to Naro-Atzia. I am Pretorious Pryce, your duly sanctioned customs officer. Your spacecraft has been docked, and I'm requesting permission to come aboard for your welcoming inspection."
Daisy,That won't be necessary.
Pryce,Not sure I understand.
Daisy,"Change of plans. We won't be visiting your planet, um, but thank you. It looks lovely."
Pryce,"Perhaps I wasn't clear. The forms have been prepared, and you're already in the system."
Daisy,"Okay, well, just take us out of the system, and then we'll be on our way."
Pryce,"Once you are in the system, you are in the system. As I said, there are forms, prepared forms. I don't like the rules, but they must be enforced."
Daisy,Fine. Come aboard.
Simmons,"Maybe he inspected Fitz's ship. We can at least ask, can't we? He could be so close."
Boyle,"These snails should fetch a good price at market, enough to buy fuel and supplies for several cycles. Where you heading?"
Fitz,Naro-Atzia.
Enoch,"And from there, back to our solar system so we can orbit Jupiter for another 72 years, 312 days, after we purchase a Cryo-Chamber."
Boyle,Your business is your business.
Toad,"You know, we heard what you did. You saved this crew, gave the Controller his walking papers. You're real heroes."
Fitz,Anyone would have done the same.
Boyle,Not around here.
Fitz,Those look good.
Toad,They taste even better.
Enoch,"These are not meant for Terran consumption, especially not on an empty stomach. We will find you nourishment after we are paid."
Fitz,"I know, but I'm starving."
Boyle,"Yeah, about that. We're just gonna take the snails and the, uh, ship, too."
Fitz,Why are you doing this?
Boyle,My business is my business.
Toad,"And yours, well... seems to be everybody's."
Boyle,It's really simple. You can get off my ship right now or we tell the local enforcers you're here.
Fitz,Take the snails and leave the ship. It's our only way off this planet.
Boyle,Tell you what. I will pay you for it.
Fitz,Really?
Boyle,"This planet has a reputation. Fortunes are lost here. But fortunes are won, as well. Maybe your luck will take an upswing."
Greeter,"Welcome to the House of Games. Please check your weapons and moral high ground, then walk through the scanner. Robots, droids, mechs, cyborgs, and synths are strictly prohibited. Violators will be removed and executed."
Fitz,I think maybe you should wait outside. Enoch!
Fitz,Hey. Hey!
Greeter,Welcome to the House of Games.
Fitz,How'd you make it through?
Enoch,"I am not a robot, droid, mech, cyborg, or synth. I am a Chronicom. I was designed with internal mechanisms that mask my non-organic structure and mimic human biological function. I can easily fool any scanner."
Fitz,Cool. Good to know. Glad you made it.
Enoch,"I must admit that this journey together, from the moment our ship was attacked until now, barring perhaps that one incident with the MazTats, has been quite stimulating and informative."
Fitz,Are you seriously trying to tell me that you're having fun?
Enoch,"It would seem that, yes, I am having a facsimile of what you would call “fun”. And Fitz..."
Fitz,"Yes, Enoch?"
Enoch,"I think, during this past year, you have become what one would call my best friend. Is it safe to assume you feel the same?"
Fitz,"Do you want to know how I feel? I feel like we are Xandarian snails. Keep moving, but we're not getting anywhere. We need money to get off this planet, and all we have is this... one lousy chip."
Fitz,Not exactly Monte Carlo.
Enoch,"One chip is all we may need. I am well-versed in over 10,000 intergalactic games of chance, several of which are being played in this casino."
Fitz,And you're only just telling me that now? Which games are you good at?
Enoch,Approximately... none. I have no experiential knowledge. I have only been an observer.
Fitz,I'm never gonna see her again.
Pryce,"You'll be on your way in no time. Please surrender your weapons per section 312-64782, paragraph 626 of boarding protocol 1516."
Piper,We better get those back.
Daisy,I don't carry one.
Pryce,"Your weapons shall be returned upon satisfactory completion of your inspection, per section 312-64782..."
Daisy,"Yeah, we got it."
Pryce,What is your planet of origin?
Daisy,Earth.
Pryce,Terrans? Purpose of your visit to Naro-Atzia?
Simmons,We're looking for this man. We believe he may be down on your planet. His name is Leopold Fitz.
Pryce,You shouldn't have said that name.
Daisy,Why?
Pryce,"Because he's here, listening."
Simmons,Fitz is here?
Simmons,Daisy!
Pryce,"Please, friend. There is no need of further violence. I am confident the remaining crew will submit peacefully."
Simmons,Davis?
Davis,Guess we didn't pass inspection.
Gambler,Yo. Here we go.
Fitz,I really don't know which game gives us the best chance.
Enoch,"Perhaps a drink will help us decide. Two Barracooladas, please."
Woman,Of course.
Fitz,What the bloody hell?
Enoch,Not to worry. They're quite delicious.
Fitz,It's not about how they taste. It's about how much they cost. How... How do you expect to pay for those liquid monstrosities with one lousy chip?
Enoch,Your point is well taken. Perhaps I should not have ordered such premium beverages. Let me remedy this situation. Hm.
Fitz,"Hey, hey! Enoch. Enoch!"
Gaming table computer,Winner.
Fitz,How did you do that?
Enoch,It had been over 30 rotations since the marker last landed on the Beast of Clovers. My computations had the precise odds of it occurring on that spin as...
Fitz,You're an advanced computer.
Enoch,That feels reductive.
Fitz,"No. Nope, not reductive. This is exciting. You can win us the money."
Enoch,It was unwise for me to have gambled. The rules are quite clear on synthetic beings.
Fitz,"Hey, hey. That's what best friends are for. Think about it... for breaking the rules, putting it all on the line."
Enoch,I am aware of instances where best friends have committed lawless acts together.
Fitz,Exactly.
Enoch,Even murder.
Fitz,"What? No. That's... That's, um... that's a really worrying thing to have said. Why not maybe just stick to gambling? This is where fortunes are won, right?"
Malachi,You and your friends are out of time.
Daisy,Says the guy who is chained to the stairs.
Simmons,Why were you asking the inspector about Fitz?
Malachi,Leopold Fitz is a wanted man.
Daisy,Wanted for what?
Malachi,Tampering with the universe.
Simmons,What made you think Fitz would be here? Was it the Cryo-Chamber?
Malachi,"I cannot speak to his purpose, only that Leopold Fitz was scheduled to arrive in the next incoming vessel."
Daisy,You're right. He's alive.
Simmons,And close. The inspector. Maybe he can help us find that ship.
Daisy,On it.
Malachi,Leopold Fitz should not be here.
Simmons,"Agreed. He should be with us, back on Earth."
Malachi,"Earth is where he died. Over a year ago, if I'm not mistaken."
Simmons,What are you?
Malachi,"A hunter. As I said previously, you and your friends are out of time."
Enoch,Hmm. The brine really is the best part. Wouldn't you agree?
Fitz,"As far as I can tell, that's where the big fish are playing."
Enoch,The table appears populated with degenerates and outlaws. It shall be an honor to join their ranks.
Fitz,That depends on your poker face.
Enoch,I'm afraid this is the only face I have available.
Enoch,"Hello, fellow brigands. I look forward to playing this game of chance with you."
Fitz,No need to make conversation.
Dealer,Next game. Ante please. First down. Call the bet. Sir. Winner player 3.
Gambler,"That's a gutsy move there, buddy."
Enoch,"Why thank you, agreeable companion."
Dealer,Place your bets.
Daisy,"So, it turns out another ship was supposed to arrive when we did, but it turned around last minute."
Simmons,Where'd it go?
Piper,"Well, it says here, the planet Kitson."
Pryce,Let me see that. Your friend must be a man of perverted desire.
Simmons,Hey.
Daisy,Why would you say that?
Pryce,"Because the planet of Kitson is a nasty place, absent any basic scrap of decency."
Piper,Someone just described Florida.
Pryce,Most are ashamed to utter the word “Kitson” as it sounds like the braying of an animal in heat. There's even a well-known saying... “What happens on the planet of Kitson”...
Daisy,“Stays on Kitson?”
Pryce,No. “Is contagious and burns.”
Dealer,Bets. Player 3 wins again.
Gambler,Mm-mmm. Look at you.
Dealer,Ante up.
Gambler,How ‘bout one for my pal here? Maybe I can get some of that good luck of yours to rub off.
Enoch,I assure you luck has nothing to do with it.
Gambler,Uh-oh.
Dealer,Place your bets.
Gambler,"Whoa, now. Shades is all-in."
Dealer,Bets.
Gambler,"That's a little bit too rich for my blood, compadre."
Enoch,That is quite useful to know.
Dealer,"Sir, your bet."
Fitz,Wait. Hey. Hey. Hey. I don't really think you want to go in on this one.
Enoch,"Not to worry. We are in good standing. And also, I may have found a like-minded friend to join in our adventures."
Fitz,"Oh, he's not our friend."
Enoch,Certainly not with that attitude.
Gambler,"On second thought, maybe I will play this hand."
Dealer,All bets in.
Dealer,Player 4 wins.
Gambler,"Looks like you could've used some of that luck after all, hm?"
Enoch,But you professed the hand as being too rich.
Gambler,Mm-hmm.
Enoch,Was that statement intentionally false?
Gambler,"You bet your ass it was. See, it didn't take long to realize that you are great at cards but dumb as hell at people. Thanks for playing, buddy."
Toad,There it goes again.
Boyle,"It's someone trying to contact the ship. Before anybody realizes what happened, we'll be living like kings on the unsullied shores of Leitner."
Boyle,Who the hell are you?
Daisy,Who the hell are you?
Boyle,"I'm the Controller of this ship, and you're trespassing."
Boyle,"Okay, everybody just suck on some calm."
Simmons,We're looking for this man. He was on this ship.
Boyle,"Oh? What's it worth to, uh... Aah! Aah!"
Daisy,"What are your bones worth to you, ‘cause I'll break every single one of them until you start talking."
Boyle,"H-How did you... Okay! Okay... W-We didn't hurt him or do anything wrong. We just... They're outlaws. We could have turned them in, but we didn't. We just took their ship and let them go 'cause we're nice."
Simmons,Them?
Boyle,"Yeah, that... ah, that guy and his friend, some creepy bald dude."
Simmons,Enoch. Fitz... he's here and not alone.
Boyle,Do you guys need anything else?
Davis,"Those. They're all yours. They look really good. Oh, my God. So good. Take some. Food."
Simmons,Where did our friends go?
Boyle,"On this planet, it could be one of two places the casino or the brothels, depending on how well they did at the casino."
Fitz,You lost everything.
Enoch,He intentionally deceived me.
Fitz,It's called bluffing. You should know. You do it all the time.
Enoch,I most certainly do not.
Fitz,You're a robot pretending to be a human. That's bluffing.
Enoch,I am not a robot.
Fitz,Chronicom. Whatever.
Enoch,Were you bluffing... when you said I was your best friend?
Fitz,What does it matter?
Enoch,"I have disappointed you, and we may be, as they say, down on our luck, but there are other ways to earn money."
Fitz,How?
Enoch,"The brothels of Kitson. We are both healthy and not unattractive specimens, and I am well-versed in over 130..."
Fitz,Stop. Brothels are not an option.
Enoch,Then perhaps a game that doesn't require bluffing but has a strategy based entirely on mathematical odds.
Fitz,Why wouldn't you start with that game?
Enoch,Because the stakes are very high.
Fitz,How high?
Fitz,Ah. Hmm. Uh-huh.
Man,Guess you don't need much muscle when you have a sizable brain.
Enoch,You earned a very good price.
Fitz,"Wait, what? I'm the collateral?"
Enoch,"That is correct. If you lose, you will be sold into slavery."
Person,"No. Oh, God, no, please. No, no, please! Please, oh, God!"
Dealer,Your seat is now available.
Fitz,"I... yeah, yeah, no. This was your idea. You play."
Enoch,"I'm the one who has to count the tiles. I will signal you using a high-pitched tone that only human ears can register. One tone for a hold, two tones for hit. Also, make sure you do not get a 14."
Fitz,"Wait, what? What's that mean? Don't get a 14?"
Dealer,"Let's begin the game, shall we?"
Daisy,"Once we get inside, we'll separate and search, and if he's not here..."
Simmons,He better be dead.
Daisy,What?
Simmons,Better dead than in the brothels.
Greeter,"Welcome to the House of Games. Please check your weapons and moral high ground. Robots, droids, mechs, cyborgs, and synths are strictly prohibited. Violators will be removed and executed."
Daisy,Are you feeling okay?
Simmons,Are you?
Daisy,I asked you first.
Simmons,I asked you second.
Daisy,"On 3. 1, 2, 3... I'm tripping balls. I'm tripping balls."
Simmons,"I'm not okay at all. Oh, we seem to be experiencing some kind of adverse reaction to something. Perhaps the atmosphere."
Daisy,Maybe sending Davis back to the Zephyr was a bad idea.
Simmons,"No, I'm sure this is just temporary. Our bodies will adjust."
Greeter,Welcome.
Simmons,So pretty.
Daisy,I'm just gonna say it. I don't think it's the atmosphere.
Simmos,No. That was silly.
Daisy,Yeah.
Simmons,It's clearly p-psychopharmacological expiali... docious.
Daisy,"Docious! Oh, I think it was the things, the little puffies that we ate."
Simmons,Bad little puffies.
Daisy,"Davis ate, like, six."
Daisy,Oh. I hope he's okay.
Piper,Hey. Hey. What is wrong with you?
Davis,I ate the yummies. Oh.
Piper,Who else had them?
Davis,"Daisy, Simmons, all those giraffes."
Piper,Hey. Stay here. Do not mo... Do not move. I'm gonna try and reach them. Stay.
Daisy,We made it.
Simmons,"Yes, we did. Why are we here?"
Daisy,Because we're on a mission.
Simmons,Right. What is the mission?
Daisy,The mission is... Ladies' night!
Simmons,Yeah! Ay-ay-ay-ay!
Daisy,Do you remember when we first met?
Simmons,Yeah. You lived in a van.
Daisy,Mm-hmm.
Simmons,And it really smelled.
Daisy,"No, it didn't."
Simmons,Yeah. We called it the Fartmobile.
Simmons,You had... You had big hair.
Daisy,"You had big... nerd face. Do you... What house are you in, hm? Gryffindor?"
Simmons,"Uh, Ravenclaw. Girl, please."
Daisy,Do you know any spells?
Simmons,"Expecto Patronum! Hello, little monkey Fitz. Fitz."
Daisy,"This might sound so weird, but I feel such a strong connection to you, like we're both different parts of the same cosmic being. Do you feel it?"
Man,Mm-hmm. I can feel it.
Daisy,I...
Man,Your ship or mine?
Davis,"I'm a secret agent in space. I'm supposed to be watching... Whoa. Uh, hey, there."
Piper,"Hey, Davis, you in here? Got you some animal crackers, you big, dumb baby. Oh, crap. Davis. Hey. Hey. Hey. Hey. Davis. Wake up. Davis. Davis! Wake up!"
Davis,That guy is like some sort of shape-shifting contortionist assassin.
Piper,"Yeah, I'm sure he is, reliable witness. Any idea where he went?"
Davis,Oh. Animal crackers.
Piper,Great.
Daisy,"Things were definitely getting weird. An alien had just propositioned me at the bar... my little British friend was missing... and everyone around me smelled like cheese. Panic was starting to take hold when I suddenly noticed a dainty pair of feet. Don't worry, everybody. I got this."
Simmons,"Hey, I think my parents are mice."
Daisy,That makes sense.
Simmons,I'm sorry for dragging you across the universe.
Daisy,"Oh, no, don't be. It's good. It's only made us closer."
Simmons,I just miss Fitz so much.
Daisy,"Aw, yeah. I'm sorry. I wish I had my own Fitz. Well, not Fitz, but, you know..."
Simmons,"No, I know. You've had just awful luck in that department. It's so sad. But you are so strong now and so confident. I'm so proud of you."
Daisy,Really? It means so much coming from you.
Simmons,You just mean so much. You're my best friend.
Daisy,"I love you, too."
Simmons,Your skin is so soft.
Daisy,I know. Shh.
Simmons,What is it?
Daisy,Shh. Do you hear that?
Simmons,"I mean, it sounds almost like a dolphin."
Fitz,Hit me.
Dealer,"25. Well played, sir."
Dealer,Are you sure?
Gambler,"Come on, green bean. I don't got all day."
Gambler,"Oh, God. No, please. No. No, no, oh, God. Oh, my God. Oh, please, please, please, please. No, no, no, no. Please, oh, God, oh, God."
Fitz,What the hell was that?
Dealer,"Never hit on 4. Five players remain. As we begin Round 6. Players, please place your wagers. Would you like to place a wager, sir? Sir?"
Fitz,"Sorry, yes. My turn. Hm. What are the odds of me getting a 7 or less?"
Dealer,Any dealer caught giving odds is fed to Mr. Kitson's Vrellnexian.
Fitz,"Sorry. I didn't know that. Uh, okay, hm. So, to hit or to fold... That is the question now."
Fitz,Aah! Aah!
Dealer,"A synth. Everybody, vacate the room. The two of you arrived together."
Fitz,"No, that was just a coincidence."
Dealer,Which would explain your good fortune. See that he and his robot friend stay put. Mr. Kitson would want to deal with them personally.
Piper,Back away from the computer. Don't even think about it.
Davis,Totally evaporated. Big guy's two for two.
Piper,"Yeah, well, he got away, big guy, and you totally destroyed our fuse box."
Davis,Oh. But where did he go?
Piper,"The real question is, who was he trying to contact?"
Simmons,Ohh.
Daisy,"Ohh, I'm never eating alien food again."
Simmons,"No, but is it possible to share auditory hallucinations? I think this is something different."
Daisy,And why does nobody else seem bothered by it?
Simmons,Maybe it's only perceptible to humans.
Daisy,Like a secret signal.
Daisy,Fitz.
Simmons,Fitz.
Simmons,Ohh.
Fitz,"Ah. Come on, now."
Enoch,What are you doing?
Fitz,I'm rebooting you.
Enoch,"I am not comfortable with this level of intimacy, even with my best friend."
Fitz,"Well, you shouldn't set off a bloody air-raid alarm, should you?"
Enoch,Whoops.
Fitz,Whoops? What's whoops?
Enoch,"That noise you refer to as an air-raid alarm, it is, in fact, a remote override of my system."
Fitz,Something did that to you?
Enoch,Not a thing. A Chronicom. I fear we are in grave danger.
Fitz,I'm pretty sure Chronicoms are the least of our worries.
Enoch,"You are unaware of the varietals of Chronicoms. I, for instance, am an anthropologist. My primary functions are intended for research and sensual gratification."
Fitz,Moving swiftly on to the types of ones that are coming here.
Enoch,Those would be hunters.
Greater,Welcome to the House of Games. Please check your weapons and... Oh...
Daisy,Excuse me. Oh. Hello?
Daisy,"Oh. Oh, man. Do those guys look like the guy that we have tied up on the Zephyr?"
Simmons,"I see them, too, which means they're very real, and they're here for Fitz."
Daisy,They'll have to get by me first.
Daisy,That was way off.
Enoch,Shut down. Which can only mean I am decommissioned. I am useless now. I have soiled the integrity of Chronicoms. The name Enoch will be an unspeakable sound.
Fitz,This isn't helping. We need to find a way out of here or they're gonna skin us alive.
Enoch,They can have my skin. I don't need it anymore. It is my uniform of shame.
Fitz,"You're not useless, Enoch, okay? You're not. So please, shut up and help me get thi... What is that smell?"
Enoch,The foul stench of the name Enoch.
Fitz,"No, it's coming from him. What is that?"
Enoch,He's a Crepetolian. Their blood is 75% sulfur.
Simmons,Hey! I got him. Fire!
Daisy,"Okay. You go. I got it from here. Are you sure? Yeah. If I can't quake it, I'll break it."
Simmons,Okay.
Daisy,"Go. Sorry, boys. It's ladies' night."
Daisy,Whoo! Oh.
Enoch,Why do I exist? I am nothing. I'm a speck of dust in the infinite.
Fitz,"Okay, Enoch..."
Enoch,An afterthought in the worm-ridden mind of the black void.
Fitz,Okay. I'm gonna need you to spark up. So you take a break from being infinite nothing and do that for me?
Enoch,Why would I do anything when there is no purpose? We will all soon be dust and rust.
Fitz,'Cause you're my best friend. Remember? That's your purpose.
Enoch,You're bluffing.
Fitz,"No. I'm not. I can't believe I'm saying this, because you are..."
Enoch,Chronicom. Decommissioned.
Fitz,"Gonna say a massive pain in the ass, but... You've grown on me. So, yeah. You are my best friend."
Enoch,"For you, my best friend, I would do anything."
Fitz,Come on.
Simmons,"P-Pardon me, sir, but I have reason to believe that my husband, sorry, uh, my future husband is behind that door."
Man,And what reason is that?
Simmons,"Uh, the... the... the dolphin told me in a secret signal only I can hear that was meant just for me."
Man,"You need to lay off those puffs, lady."
Simmons,Is it that obvious?
Man,You've been under that gaming table for the last 20 minutes.
Simmmons,That long? I've lost my mind. I've completely lost my mind.
Daisy,Please let that be the last of them.
Simmons,I don't even know what I'm doing here.
Man,Then maybe it's best you just go on home. This isn't a place for a nice girl like you.
Fitz,Jemma?
Simmons,Fitz?
Enoch,Jemma Simmons? You should not be here.
Jaco,They have nice stars here.
Sarge,"Seen better, seen worse."
Sarge,Okay. It's ready.
Jaco,How many do you think there are?
Sarge,Stars? I don't know.
Jaco,Not stars.
Sarge,Guess we're about to find out.
Jaco,Well?
Sarge,"Seen better, seen worse. Let's go make a mess."
