character,line
Coulson,"Ward, how are things on the ground?"
Ward,We've got most everyone safe in the boiler room.
Weaver,"Everybody, move back! Make some space!"
Ward,How bad is this gonna get?
Coulson,Bad. Can you reach the North campus parking garage? We think Donnie Gill and his device may be trapped in the center of the storm.
Ward,"That's not far from where I am. I can get there. Yeah, I can't get there."
Coulson,"Is there any other way to get to Donnie? Think fast, people."
Fitz,I know one way.
May,Hold on tight.
Donnie,"Seth, hold the barium hydroxide chamber in place!"
Seth,Okay!
Donnie,"Hold on! Okay, that should do it. Now take... Aah. Seth! Seth? We're gonna have to try to get underground, ride it out till the storm passes. Hey, Seth. Seth! Hey, hey, Seth. Seth, can you hear me?"
Donnie,"He's been hurt! Please, you need to help him!"
Simmons,"He's in cardiac arrest! Skye, get a blanket for his head! Lay him down here! Sir, I need the A.E.D.! Fitz, oxygen. 0.4 millimeters of epinephrine."
Fitz,I got it.
Simmons,Get ready to clear. Charging.
Fitz,Aah! Get back!
Simmons,And clear! Pulse?
Coulson,Nothing.
Simmons,Charging. Clear. Pulse?
Simmons,Charging.
Coulson,He's gone.
Donnie,"No, sir. Seth! Seth!! Come on, no! No. Don't go. No."
Fitz,"Donnie, I wanted to wish you good luck. And I'm very sorry."
Donnie,Don't say you're sorry. My only friend is dead because of me.
Fitz,I don't know what else to say.
Donnie,Then don't say anything.
May,What will happen to him?
Coulson,"They're moving him to the Sandbox, but not as a researcher. They want to keep an eye on him."
May,"Did, uh, you hear what I said in Mexico?"
Coulson,"What, specifically?"
May,"A-about Ward and me, um..."
Coulson,"Yeah, I heard. I trust you know what you're doing, and if it's a problem..."
May,"I'll end it. Skye requested a moment alone on campus. You told her, didn't you?"
Coulson,I had to.
May,It must have destroyed her to hear all that.
Coulson,"That's the thing about Skye. What I told her shattered her world. Her lifelong search led to stories of murder, and now it's too difficult to continue. Her search is over. Her story ends here. But you know what she said?"
May,Tell me.
Coulson,"She said “no.” Her story started here. Her whole life, she thought she wasn't wanted, that she didn't belong, that every family that took her in didn't want her to stay, didn't care. But all that time, it was S.H.I.E.L.D. protecting her, looking after her. That's what she took away from the story, not the family she'll never have but the one she's always had. Here I am, telling her something that could destroy her faith in humanity. And somehow, she manages to repair a little piece of mine. The world is full of evil and lies and pain and death, and you can't hide from it, you can only face it. The question is, when you do, how do you respond? Who do you become?"
Quinn,"Seth, I've gotta say... you have exceeded my expectations."
Coulson,We're on to you.
Quinn,Who is this?
Coulson,"Agent Phil Coulson with S.H.I.E.L.D. We've never actually met, but I'm familiar with your work... all of it."
Quinn,"So, this is a “getting to know you” call?"
Coulson,"No, just a message that the first time your aircraft drifts over any country allied with S.H.I.E.L.D., we will shoot you out of the sky."
Quinn,"So this is a courtesy call. Well, thank you, Agent Coulson. And I have a message for you. The Clairvoyant told me to say hello."
