character,line
Daisy,"If there's some sort of secret afterburner you haven't kicked in yet, now would be the time."
Lincoln,They're going as fast as they can. We'll get there.
Daisy,"Coulson's team vanished halfway around the world, and we still have two pickups to make. Fly faster."
Joey,You have to come up and see the roof. The city glows off the bay.
Kevin,I would really like that.
Elena,Hello. It's good to see you again. You look well. Hello. It's...
Joey,Only maybe not tonight.
Kevin,Really?
Joey,I'm sorry. Something's come up.
Daisy,"Satellite scans show massive hidden doors, a hangar buried under the oil fields about 300 feet."
Elena,"What is, uh, HYDRA?"
Daisy,"Kidnapping Inhumans, global terrorism, all-around bad dudes."
Joey,How'd they take the plane?
Daisy,Don't know.
Joey,What's the base's layout?
Lincoln,Don't know.
Elena,How many soldiers?
Daisy,"We don't have much, but these are friends who've put their lives on the lines for each of us, right? But we do have a way in, service wells that can get us within 50 feet of the base."
Joey,And what about the other 50 feet?
Daisy,I'll take care of that.
Joey,"Okay. Uh, when do we land?"
Daisy,"For one reason or another, each of us has been given a gift. Let's put ‘em to good use."
Giyera,"I'm glad you've arrived. They had our location, so I took the plane."
Hive,What about the agents? Did any survive?
Giyera,"I was outnumbered, so I got off as quickly as I could, sent in a team. Lucio will have them under control soon."
Simmons,Come on! Come on! Coulson!
Coulson,Look for anything in here that will mess with those guys.
Simmons,May's bleeding pretty badly. We need to stop it now.
Mack,The hatch won't hold for long.
Coulson,"Fitz, find me something that will keep these guys at bay."
Joey,"Well, I guess we can call this area clear."
Daisy,"Split up. Lincoln and I go solo. You guys take the elevator. Find our team, and report back."
Daisy,"I got eyes on the Zephyr. Entrance is on the north side, sub-level 5. Crash on that location."
Lincoln,I've got Malick.
Simmons,Catalyst. Careful.
Fitz,Here's a cloth. May needs compression.
Simmons,On it. The door.
Mack,Here. This seal gonna hold?
Fitz,"Hope so. It's chlorine gas. If not, we'll all go blind."
Mack,What?
Daisy,"Guys, I'm coming to you."
Elena,Joey!
Daisy,I said I'd come to you. You okay?
Joey,"Yeah. Go, go, go."
Joey,Lincoln! Lincoln!
Coulson,Shoot anything that comes through that door.
Elena,Hello?
Mack,What the hell?
Elena,Mack. It's good to see you again. You look well.
Mack,I'm doing real good now.
Coulson,What took you so long?
Daisy,Sorry. Had to get the band back together. Got anyone who can fly this thing?
Simmons,May! You can't even walk!
May,But I can still fly.
Giyera,We lost them again and achieved nothing.
Hive,Not true. Now we have one on the inside.
Elena,"Elevator door open. He comes out. Bullets. Boom, boom, boom! And soldiers... “Aaah!” This man!"
Joey,"Hey, I stopped the bullets, but you dropped ‘em down."
Daisy,"You guys all did so good. We were asked for a miracle, and we came through. You're a hell of a team. You okay?"
Elena,"Oh. I didn't feel it. You run fast, things happen, huh?"
Daisy,You sure you're all right?
Elena,Yeah.
Lincoln,Hey. Thanks for having my back when I went down. You saved me. Daisy's right. It was a good day.
Daisy,"No, when you grab the head of HYDRA, it's a great day."
Joey,You think he'll give us anything?
Daisy,"Well, Coulson's questioning him now. Soon, you'll get cleared to go home, but if he talks, we might be on another mission."
Coulson,"You had Rosalind Price killed. I haven't decided what to do about that in the long run, but right now, I need to know. What is that thing parading around as Grant Ward?"
Malick,You ever ride Arabians?
Coulson,I'm not really the equestrian type.
Malick,"Magnificent horses, hard to control. Stephanie rode Arabians, my daughter. We were riding once in the Tetons, and there was this rockslide up ahead, and her horse bucked, threw her right off. And my heart stopped. But she got up and, calmed that horse in a way that made me more proud than anything I'd ever done. And that was the day I told her about HYDRA. Brought her into the fold."
Coulson,"Where's Stephanie now, Gideon?"
Malick,I was foolish. I thought that I could bring back the HYDRA and guide it the same way Stephanie commanded that horse. I taught her to have faith in it as a god. And she did.
Coulson,If you ever want to see her again...
Malick,He killed her! It cares nothing for us.
Coulson,Doesn't sound like a god.
Malick,"Oh, no, Mr. Coulson. It is a god, it's just not ours."
Daisy,What are you doing?
Lincoln,Just checking it out. You really think it belonged to that Alveus guy? It's so old.
Daisy,"I don't know, but we better check it in along with the Terrigen."
Lincoln,You're still upset I took that crystal to James' shack.
Daisy,"Yes, I am. You should have told me."
Lincoln,"I thought, if you didn't know, you couldn't be blamed."
Daisy,And if something went wrong?
Lincoln,I know. I'm sorry. Can't be easy having your boyfriend on the team.
Daisy,Not when you take advantage of that relationship.
Lincoln,I thought you'd understand the move.
Daisy,It was a good play. Just tell me next time.
Lincoln,You should check in on Joey. I think killing Lucio has him pretty shaken.
Daisy,I completely missed it.
Lincoln,"They did good today, but there's a lot to get used to at S.H.I.E.L.D."
Elena,"I have a new name, too. They all call me “Yo-Yo.” Your fault."
Elena,"I will get my revenge. And your Spanish is much better, not just “pescado.”"
Mack,"Yeah. It's a new S.H.I.E.L.D. requirement. I know you think S.H.I.E.L.D. is dangerous, but, really, our mission is to protect. (in Spanish) We do our best not to kill. Doesn't kill. Doesn't kill. Doesn't kill."
Elena,And these?
Mack,"Those kill. You do your best, but... some days are tougher than others."
Elena,"It's okay, Mack. I trust you."
Simmons,What on earth are you doing?
Fitz,"Well, you're the doctor. Is he dead or not? His body temperature is 98 degrees."
Simmons,Dead-ish. There's some sort of metabolic activity. Fascinating.
Fitz,"No, not fascinating. Quarantine."
Simmons,Quarantine.
Simmons,Excuse us. Nothing to worry about.
Malick,There is a reckoning coming. You put your faith in the Inhumans like I did. It is a deadly mistake. They will all worship him.
Coulson,"He's not a god. As far as we know, he was a slave to the Kree."
Malick,What better beginning for a god?
Coulson,"They called him “Alveus.” Do you know that word? It's Latin. It means “Hive,” which is fitting, because he's a parasite. Swarms, eats, moves from corpse to corpse."
Malick,"Well, that's one way to see it. You're not really a religious man, are you?"
Coulson,I have faith in my team.
Malick,That's what he'll destroy first.
Coulson,You said they'll worship him. What did you mean?
Malick,"I'm saying that those that were loyal to me now serve him. He infected them, became a part of them, and they instantly joined the hive."
Coulson,Mind control? You're the head of HYDRA. Why would I ever believe you?
Malick,"You don't have to believe. You'll see soon enough. You sent four Inhumans into his lair, and now they're in your base. How many of them do you think he turned? If you trust any of them, stop now."
Mack,Everything okay?
Coulson,I need you to quietly lock down the base.
Fitz,Malick has no proof.
Coulson,I have to take this threat seriously.
Fitz,"Well, then, let's get ahead of it. We can talk to them, scan them."
Simmons,We have no way to test for this.
Mack,"If any of them are sick, they could be very dangerous. They need to be in containment now."
Coulson,"Then what? Simmons said it, there's no test. Are we gonna question them? What do we ask? “Are you infected? No? Great. Thanks.” None of this works if they know we know. I need more."
Simmons,Lucio's body had some abnormal readings. Maybe we could start there.
Fitz,That could help us confirm whether Malick's full of it.
Coulson,"Get me proof. If this is real, any one of them could have been turned or all of them. I need a test and then a cure."
Mack,That's a hell of a gamble.
Coulson,"It's our best shot. We keep everyone contained to the base. If anyone's infected, they came for a reason. We monitor them, let them show their hand."
Fitz,"They saved our lives, and now we can't trust the lot of them."
Daisy,S-Sorry. I came when I saw the base was on lockdown. What's up?
Coulson,It's a security precaution while Malick's in custody.
Daisy,Right. Did we get any info on Zombie-Ward?
Coulson,"Not yet, but I'm confident we will."
Daisy,"Good. If we get intel, let me know. I'd like my team to get another shot at him. Um, but, you should know Joey crossed off Lucio. I'm not sure he was ready for that already to be back in the field after it."
Coulson,That's hard. I'll check in on him.
Daisy,Thanks.
Coulson,Get me answers.
Elena,What do you mean? I'm not leave?
Daisy,This is common. It's just a security thing since Malick's here.
Elena,"Security? (in Spanish) More like paranoid. (in English) I want to do something, or I go home."
Lincoln,Have they cracked him yet?
Daisy,"He's cooperating, but we have to be patient. We'll get our chance."
Lincoln,Have you talked to Joey yet?
Daisy,I've tried. I can't find him anywhere.
Lincoln,Time for your pain meds.
May,I don't want that.
Lincoln,"Trust me, in an hour, you will."
May,Those knock me out.
Daisy,"May, he's trying to help you. Just give me a minute with her. Meet me in my room?"
Lincoln,Yeah.
Daisy,"How are you doing, really?"
May,"I'm in a lot of pain, and I hate this hospital gown."
Daisy,Mm. You think?
May,You did good today. You led them well.
Daisy,Does it ever get any easier?
May,Only harder. Why?
Daisy,I think Coulson's having me lie to them about the base lockdown. They can feel it.
May,"Sometimes, that's the job."
Daisy,Doesn't feel right.
May,"If he's withholding, I'm sure it's for the right reasons."
Coulson,"I got to ask, you wanted all of this. What did you think would happen?"
Malick,You don't understand what it's like to be brought up in faith.
Coulson,"We were “C and E” Catholics. Sure, it's no death cult."
Malick,"Then you know we all have our sins. I believed that I could resurrect a god. But instead, I freed the Devil."
Coulson,"Only technically. I mean, all the ancient Satanic creation myths, they were based on him, which you knew."
Malick,"The Devil promises everything and then lets you destroy your own world. I sacrificed my brother to him. Still, he took my daughter. And that image of her body lying on that floor. I failed her. W-What else matters?"
Coulson,What you do next matters.
Malick,Are you trying to sell me on the idea that I can set everything right?
Coulson,"I'm trying to sell you on revenge. I have an image, too, of a body on the floor. Rosalind Price. Love turned to rage in that moment. So I hunted down and murdered Grant Ward. Not to serve any good. Not to serve any belief. I wanted revenge. I wanted to feel him die. That's the sin that gave your Devil new life."
Malick,To come and take everything we love.
Coulson,Let it turn into rage. Tell me how to stop him.
Malick,This god has outlived...
Coulson,I've met gods. Gods bleed.
Malick,I never saw my last rodeo being with S.H.I.E.L.D. What would you like to know?
Coulson,Start with everything.
Joey,No. You can't ask me to do that again.
Lincoln,"Trust me, Joey. We'll figure this out."
Mack,Now I'm just seeing things.
May,"Whatever the hell is going on, the Inhumans are wondering about it. Also, what the hell is going on, Mack?"
Mack,Too damned much.
Simmons,"Subject was 36, male, Colombian. Cause of death, exsanguination due to stab wound."
Fitz,Toxicology and blood work have shown normal levels.
Simmons,"Though the body maintained a temperature of 98 degrees, which is very bizarre."
Fitz,"Simmons will try and make this sound science-y, but for the record, we're about to split open this guy's head."
Simmons,Fitz doesn't approve of voice notes.
Fitz,"Ohh. So, um, you seen any movies lately?"
Simmons,You're asking me to one? What's wrong?
Fitz,I just want an hour without imagining that half our teammates are gonna kill us. Joey offed this guy. Picture the hell Yo-Yo could raise or Daisy.
Simmons,"Lincoln could electrocute us in our sleep. Or any time, really. I see your point."
Fitz,How do we land in these situations?
Simmons,We're S.H.I.E.L.D. agents. Today could be worse.
Fitz,We're in hazmat suits.
Simmons,Yeah. To help our friends.
Fitz,They're lucky to have you.
Simmons,Fitz.
Coulson,Why are you calling me out of an interrogation? And what the hell are you doing out of bed?
May,Fitz-Simmons are on their way. They confirmed Lucio's infection. Malick wasn't lying.
Coulson,I so badly hoped he was.
Mack,"The parasites infest deep in the brain, but the good news is it doesn't seem to cause permanent damage."
May,"But they don't have a test, not yet."
Mack,Surveillance isn't working. They're all over the base. It's a threat.
May,"We need to quarantine them. I don't know how to convince them, but..."
Coulson,Telling them is too dangerous. We have to ice them. I'll explain when they're safe. Anything suspicious on the cameras?
Mack,"Everyone looks suspicious if you stare at them long enough. I mean, Joey's a ghost, arguing with Lincoln. And I think Yo-Yo scoped out every angle of this base."
May,Lincoln tried to pump me full of meds before I talked to Daisy.
Mack,"Yeah, but he is a doctor."
Coulson,What did Daisy say?
May,She felt like you were lying to her.
Coulson,What game are we playing?
May,I think we're about to find out.
Fitz,Somebody sabotaged the power. Good luck escaping. Perimeter security is on the emergency generator.
Simmons,Fitz.
Fitz,But the security cameras aren't. Is that Malick's room?
Coulson,Are you all right? What happened? You okay?
Simmons,Malick's door was open. He was already dead.
Fitz,A bloody grenade went off right in front of us.
Coulson,Covering up the cause of death. Can you walk?
Fitz,Yeah.
Coulson,Okay. Come with me.
Simmons,Okay.
Coulson,"Mack and May are gathering teams to quarantine the Inhumans. Get yourselves patched up, and find a place to lay low for a while."
Lincoln,What happened? Are you okay?
Simmons,We're fine.
Fitz,She said she's fine.
Lincoln,I'm trying to help.
Daisy,What was that blast?
Coulson,Go into the common area. I'll brief everyone there in a few moments.
Lincoln,Are we in danger? What the hell?
Coulson,Go into the common area. That's an order.
Daisy,You've kept us in the dark all day.
Coulson,"There's a situation, Daisy. I need you to get your team to cooperate."
Elena,Were we attacked?
Mack,Everything will be all right. I just need you to stay right where you are.
Coulson,"May, be cool. Where's Joey?"
Dasiy,"I don't know. Coulson, you need to level with me right now."
Coulson,We need to get you checked out. Hive can sway Inhumans. Your team may have been exposed in the rescue.
Lincoln,"Wait. Sway, like mind control?"
Coulson,"One of you killed Malick. I'm trying to keep everyone safe, including you. Where's Joey?"
Daisy,My team wouldn't do that.
Coulson,They wouldn't have a choice. It's like an infection.
Mack,"I swear that's what I'm doing, Yo-Yo."
Lincoln,"We saved your asses, and you come at us?"
Daisy,Lincoln. Why didn't you tell us?
Coulson,"Daisy, stand down."
Coulson,"First, we get everyone in quarantine, and then we can talk."
Lincoln,"Not everyone. Anybody in here could have killed Malick, but you singled us out right away!"
Daisy,"Lincoln, stop it!"
Joey,What's happening?
Daisy,Where the hell have you been?
Lincoln,"If we don't get these doors blocked, nobody's questions get answered!"
Elena,Got it! Okay.
Joey,Someone explain what's going on.
Lincoln,Malick's dead. They suspect us.
Joey,"Well, why would they think that?"
Daisy,They think Hive infected one of us while we were in that base.
Lincoln,Messed with our heads.
Daisy,Where were you?
Joey,What?
Daisy,"Where were you, Joey?"
Joey,The base went dark. I was looking for you. Infected?
Elena,That glass not gonna keep them out.
Lincoln,Right. How do we fix this?
Daisy,"We stay calm, and we stick together."
Joey,Why are they sure it's one of us?
Daisy,"Malick, whatever he said to Coulson has him spooked."
Joey,"But he could be wrong. I mean, they're taking his word for it?"
Daisy,What?
Lincoln,What?
Elena,Screw S.H.I.E.L.D.
Lincoln,Jiaying was terrified of Hive returning. Now I can see why. You know Fitz-Simmons quarantined Lucio's body?
Joey,Why didn't they tell us sooner?
Daisy,"If that's true, this is exactly why Coulson didn't say anything. Anybody has..."
Joey,"And if that is true, I don't want you telling me what to think. Any of you. We were all alone in that base. Any of you could be infected."
Lincoln,Any one of us. That includes you.
May,They're ready to go. Or we can pump in sleeping gas if you give me 10.
Coulson,"Contain for now. If they're arguing, that means they're not all turned. Search their bunks and lockers. Figure out what we're missing here. Hopefully, someone in there is doing the same thing."
Lincoln,"I saw it, Yo-Yo. That's not a bullet wound, so how'd you get it?"
Elena,I fight 10 people. Accident. (in Spanish) Why doesn't he believe me? Help me explain.
Daisy,What are you saying? Could you please speak English right now?
Joey,"Hey, look. It's not important, okay? I don't care which one of you did this. I just want to leave, one way or another."
Daisy,"Are you saying you'll fight S.H.I.E.L.D. to get out of here? Because that means me, too."
Joey,They're about to break in. I am not going back into isolation.
Elena,"Why not? Alone all day, no?"
Joey,"I just needed some time, okay?"
Daisy,"Joey, you were completely AWOL when Malick was killed. That's not okay."
Joey,"I don't care about Malick! You were the one gunning for him, and now he's dead. That's not on me."
Daisy,"Gunning for intel, not to kill him. He's the head of HYDRA."
Lincoln,But it's a fair point.
Daisy,Excuse me? I wanted to get to Malick to finish off Ward or... or Hive or whatever. Friends died. You know that.
Lincoln,Where were you when the lights went out?
Daisy,"I was in my room where I told you to meet me. Where were you, sparky, during the electrical failure? Sorry. We're supposed to be a team."
Elena,This team is sick.
Joey,How do we know whoever turned can't infect the rest?
Lincoln,There's no evidence of that.
Joey,"I just want out, with or without your help. Hey, hey, hey!"
Lincoln,"Suddenly, you're willing to fight your way out?"
Elena,"Me, too. I don't trust anyone."
Lincoln,No one leaves.
Joey,We need to get out of here.
Daisy,"Stop! He's right! He's right. We should get somewhere safe, figure this out on our own terms."
Lincoln,What? We can't leave and let an infected person escape!
Daisy,It's better than someone in here or out there getting killed. Okay. Coulson has a hidden elevator. It used to be an old underground exit. Maybe I can break through to get out. It's the only way we all live today.
Joey,Okay. Let's go.
Fitz,Do we even know what we're supposed to be looking for?
Mack,We do now.
Daisy,"No, no. This way. It's not much farther. The original passage is hidden through here."
Joey,I hope you're sure about this.
Joey,You sold us out!
Daisy,"I'm sorry. If someone's infected, I had to make this call."
Coulson,"I mean no harm. We're all a part of the same team, but one of us is sick. I didn't say anything earlier because we didn't know who it was, but now we do. Let me guess, when you decided to leave, Lincoln didn't want to go. Not without his prize. This was taken from the Assets room and hidden in your locker."
Lincoln,"I didn't do that. Daisy, you have to believe me."
Coulson,You know how to get in there. You've stolen from that room before.
Lincoln,Yeah. That was different.
Coulson,"No. That was exactly the same. From the moment Hive popped up on our radar, you suddenly knew where to find this and had your hands on it until our distress call diverted you to Malick's base."
Lincoln,Exactly. That was before any of this could have been exposed to Hive!
Coulson,Was it?
Daisy,Transia. The rooftop.
Coulson,"Daisy fought Malick. I found the bodies. But you said you caught a glimpse of Ward, didn't you?"
Daisy,So you're saying he wasn't turned last night?
Coulson,No. He's been turned this whole time.
Lincoln,I wasn't anywhere close to Hive!
Coulson,"We can fix this, Lincoln. Let us help you."
Lincoln,Leave me alone!
Daisy,Lincoln!
Daisy,"We were good together. And yet, it took so little to split our team apart. I failed them."
Coulson,"This is being a leader. You want to protect everyone, but you can't. People get hurt. Today wasn't your fault."
Daisy,Doesn't feel that way.
Coulson,We were attacked by something very smart and very dangerous. Hive destroyed the most sacred thing for a team.
Mack,Yo-Yo.
Elena,My name is Elena.
Coulson,Trust.
Joey,When will the results come in?
Simmons,Soon.
Joey,Good. Because I think I don't want to be here anymore.
Coulson,"I know you want to destroy Hive for what he's done to you. We all do, and we will. I know you want revenge, but we have to be better. We have to do what's best for the team. It's times like these when there's no clear path that I understand why people pray. We don't know if any of the rest of you are infected, but we will soon. Even so, the Inhumans cannot encounter Hive. For the time being, I have to keep you in quarantine. I have to disband your team, Daisy. I'm sorry."
Daisy,We'll be stronger next time. You'll see.
Fitz,Temperature differential?
Simmons,Too similar.
Fitz,Brain biopsy?
Simmons,Too lethal. Dopamine levels?
Fitz,You think it drugs them?
Simmons,I have no idea how to help them. We should be in the lab.
Fitz,"Well, we're running every test that we can."
Simmons,"One of these days, we'll find something out in space that's magnificent, right? Not trying to infect us or kill us like Hive."
Fitz,"What's Hive? Couldn't even get off a desert planet without us, so... we'll sort him out."
Simmons,I just want to help our friends.
Fitz,I know.
Fitz,Sorry. Uh... sorry. I know everything with Will and starting over. I didn't mean to push too fast.
Simmons,"Too fast? Fitz, it's been 10 years. We can't waste any more time."
Fitz,Really? 'Cause I thought that...
Simmons,Really. And since we're cursed or whatever nonsense...
Fitz,I said that one time.
Simmons,"Well, and you and your fourth-dimension idea..."
Fitz,"And for the record, actually..."
Simmons,... that we can't change fate.
Fitz,...today is more evidence that the cosmos is against us.
Simmons,I'm tired of seeing our friends ripped apart from each other. That can't happen to us again. I won't let it.
Fitz,"Then we won't let it. Who needs space? Because I've got something magnificent right here. A picture of space. One of my prized possessions, that is. I don't know why it makes any significance to..."
Simmons,Okay.
Daisy,I had to see you.
Lincoln,Daisy. I didn't do anything. I-I promise. I did not betray the team.
Daisy,I believe you. I believe you. That's why I came. I came to get you out of here.
Lincoln,What? Are you serious?
Daisy,We could just walk right out of here.
Lincoln,They wouldn't understand.
Daisy,I don't care. We can be together.
Lincoln,We can't just throw S.H.I.E.L.D. away. They'll find a test and see that I'm innocent. How did you get out of your cell?
Daisy,"I'm the one who programmed the security features. Lincoln, S.H.I.E.L.D. can't hold us."
Lincoln,"But we want them to, right? Daisy, what did you do?"
Lincoln,I've got Malick.
Daisy,I have to get back to the base. They have something we need.
Hive,Do it.
Daisy,"Guys, I'm coming to you."
Lincoln,"So, this is what Hive's sway looks like. Daisy, he's using you! You're... You're sick."
Daisy,"No. I'm happier than I've ever been. You get it. You've felt an emptiness your entire life, like me. We've tried to fill it, but it never works. I found the answer and it's beautiful. It's... It's... It's a bond."
Lincoln,"Beautiful? Daisy, people are dying!"
Daisy,Malick?
Malick,So it's you. I was curious who Hive would send. I know what you're gonna do.
Daisy,We can't let you keep talking.
Malick,And I won't be kept from my daughter.
Daisy,"If I'm honest, I might enjoy this."
Daisy,Malick doesn't matter. He could only hurt us. What we are trying to build...
Lincoln,Do I matter that little to you?!
Daisy,"No, I care about you! I..."
Lincoln,"The Daisy I know wouldn't betray S.H.I.E.L.D., wouldn't throw away what we have! Y-You framed me."
Daisy,I'm sorry. But Coulson had to find his rat so S.H.I.E.L.D. could stand down. And you have trouble keeping your temper.
Lincoln,Really?
Daisy,But I'm not throwing you away.
Lincoln,You... You... You used that against me?!
Daisy,I'm here for you now! We care about you. We could have all of it together.
Lincoln,No. I don't want any part of this.
Daisy,You'll understand someday.
Lincoln,Daisy!
Giyera,"Preparations have been made to leave. We need somewhere safe. With what we did to his daughter, I worry Malick will turn on Hydra."
Hive,That won't be a problem. Gideon is dead. HYDRA's evolved.
Giyera,"In that case, there is the issue of his estate."
Hive,I'm aware of his wealth and not concerned. We find Skye next. I believe I know where she's headed.
Giyera,Of course. But there is a considerable portion available to move now.
Hive,How much?
Giyera,Roughly $960 million.
Hive,Hmm. Malick built something very impressive with his life. Let's spend it.
