character,line
Raina,How did you do that?
Chan,A magician never reveals his secrets.
Raina,Then I'll have to pierce your shell and gaze within?
Chan,You understood? Chan Ho Yin.
Raina,Raina. I would love to see that fire trick again.
Chan,I don't think that's a good idea.
Raina,Of course not. It's a great idea.
Chan,I am sorry for the clutter. I'm in between places.
Raina,How long have you been here?
Chan,Six years. Beer?
Raina,You seem to have an appreciation for the greats.
Chan,I idolized him for many years.
Raina,And now?
Chan,"There's no real magic there, just tricks."
Raina,And what you do... those aren't tricks? Show me.
Chan,I'm sorry. I really shouldn't.
Raina,Says who? What are you afraid of?
Chan,It's not me who's afraid.
Raina,That can't be real.
Chan,See for yourself.
Raina,How long have you been able to...
Chan,First time was a few years ago. A dish towel caught fire in my hands. I almost burned down my entire apartment.
Raina,And it doesn't hurt?
Chan,Not even a little.
Raina,You have a gift. I've never seen anything like it. Why not show the world?
Chan,"I ask that same question every day. There are people who... Never mind. It's just, for years, I did illusions, tricks, like the rest. And then this happens. It's real... real magic. If I believed in such things, I would say it was a miracle, that this happened for a reason."
Raina,I believe you've been chosen.
Chan,You do?
Raina,Close your eyes... and I'll show you. That'll do.
Ward,Every decision you make from here on out has consequences. So be warned. The kiddie gloves are off.
Ward,Hit.
Skye,"Yes! Ha! So, explain to me again what this has to do with my training."
Ward,It's important for every S.O. to evaluate their student's thought process.
Skye,Mm-hmm.
Ward,And I like board games. B10.
Skye,"Nope. This isn't thinking. This is stabbing in the dark, but it's nice to take a break from the workouts."
Ward,"Well. You deserve a break. I got to give Coulson credit. I would have never pegged an Ex-Rising Tide hacker as a good fit, but... you're picking things up pretty fast."
Skye,Did you just give me a compliment?
Ward,"I... no, I made a comment."
Skye,A kind one. Did it physically hurt to do that? Do you need an ice pack? Wow! A compliment and a smile!
Ward,Comment.
Skye,"I don't want to ruin the moment, but I'm gonna have to respond with... G4. Say it, Ward. Say it."
Ward,You sank my battleship.
Skye,Yes!
Ward,"All right, best 2 out of 3."
Skye,I beat you.
Ward,Best 2 out of 3.
Skye,Best I just won out of nothing.
Coulson,She's fitting in nicely.
May,Gloating?
Coulson,A little.
May,You were up early this morning. Heard you puttering around even before I started Tai Chi. Having trouble sleeping?
Coulson,"No, I feel great. Just have a little extra energy to burn."
May,"If you want, I could lay out the mats downstairs. We could go a few rounds, like the old days? Saved by the bell."
Coulson,"Chan Ho Yin. Just a struggling street performer until a few years ago, when Mr. Chan began to exhibit moderate pyrokinetic abilities."
Fitz,So what gave him powers?
Coulson,"It's still under investigation, but Chan did live near the decommissioned Wan Tai nuclear plant when it caught fire. To our knowledge, no other nearby residents have exhibited similar traits."
Simmons,So how did we find out about him?
May,Informant saw him lighting torches in a street show... with his pinkie.
Coulson,Brought it to S.H.I.E.L.D.'s attention. We told him to keep his abilities under wraps. He's been on the Index ever since.
Skye,The Index?
Simmons,It's a list S.H.I.E.L.D. keeps of people and objects with powers.
Skye,Wait. What? How many are there? Are you saying there are more people...
May,Not many.
Skye,"Well, enough to keep a list."
Coulson,"A short list, meant to protect them."
Ward,"Though, in rare cases, S.H.I.E.L.D. has had to take action."
Skye,"Action against objects or people? Well, that's drastic with a side of creepy. How are they monitored... Tapped phones, satellite surveillance, body probes in dark, unpleasant places?"
Fitz,"Body probes? Now, that's ridiculous. S.H.I.E.L.D. doesn't do that. We don't do that. Do we?"
Coulson,The methods vary. Mr. Chan was low-risk. He was assigned a case agent who checked in with him every few days. That's how we discovered him missing.
May,"Everyone, this is agent Kwan, Chan Ho Yin's case agent. What can you tell us?"
Kwan,"Not much, I'm afraid. Chan is a magician, so at first, I thought he'd made himself disappeared."
Coulson,The file says you'd caught him violating his Index agreement before.
Kwan,"On two separate occasions... claimed we were “hampering his artistic expression.” But late last night, he was taken by professionals. The only thing they left behind was this scrap of aluminized material."
Simmons,Fireproof clothing.
Ward,So whoever took him knew about his power.
Kwan,"Yes, and we think we know why. Over the last few days, tech division discovered a crack into our data stream. It's the same cyber punks who hacked us before. Somehow, they got in again. It's the Rising Tide. Heads turn. Hello? It got real quiet. You guys still there?"
Skye,The Rising Tide is a huge organization of hacktivists from all around the world. Any of them could have done this! It wasn't me.
Ward,No one's saying it was.
Skye,But you're thinking it. I can see your faces thinking it.
Coulson,We're assessing the situation.
Skye,Then I'm sure you're taking into account that I have been living on a plane with you this whole time. It would be impossible for me to hack S.H.I.E.L.D.
Coulson,Or easier. We're gonna need more than that.
Skye,"Fine. Let me trace the hack, and I'll prove it."
Ward,"I believe her, sir. And if she's telling the truth, we need to track down the person responsible."
Coulson,"Dig up something, and fast. The longer Mr. Chan's missing, the more danger he's in."
Raina,"Good morning, Chan."
Chan,What the hell?
Raina,I apologize for last night. It was important I bring you in under the radar.
Chan,Oh. S.H.I.E.L.D. Tell Agent Kwan I don't need to be read the power protocols again. It was just a street performance... it's not like I set anyone on fire.
Raina,I don't work for S.H.I.E.L.D. I come as a friend.
Chan,"English isn't my first language, but that word means something different than you think."
Raina,"I understand your frustration, but I believe you have a gift. And if you let me, I'd like to help you nurture it. I can increase it. You'll get people's attention then."
Chan,Increase my power? Why? What's the catch?
Raina,I'd like to run some tests.
Chan,"There it is. Now, will you let me go, or must I fight my way out?"
Raina,"Leave now, and I'll forget you, I promise, but so will everyone else. Stay, and you can be remembered, known the world over."
Chan,You want to make Chan Ho Yin a famous name?
Raina,"No. You need a simpler name, a... a more powerful name, a name like... Scorch."
Chan,Scorch? Are you joking?
Raina,"Have you ever heard of Steve Rogers? No. But Captain America... now, he's on the news, on a lunchbox, on a poster on the wall."
Chan,I don't want to be a superhero.
Raina,You want to be recognized. For your gift. And who is more recognizable than them?
Chan,I was given this power for a reason. I just want people to see what I can do.
Raina,"They will. All I want is what you want, for you to be remembered, to be seen for what you're meant to be... a star."
Chan,Scorch. It's growing on me.
Coulson,How close are we?
Skye,Almost there.
Fitz,She's identified the remote-access Trojan and the infected endpoint...
Simmons,And is searching for a TCP to correlate the hypertext with signature information and then...
Fitz,Bob's your uncle.
Simmons,Voilá!
Coulson,You get any of that?
Ward,Only the uncle part.
Skye,"We got our origin. Austin, Texas."
Coulson,You got a name?
Skye,"Just the café our hacker worked out of, but I'm in the system. I'm gonna check to see if any credit card charges from that day match up with any known hackers. We got a hit."
Fitz,"Miles Lydon, not Skye... that's to all of our relief."
Coulson,You know him?
Skye,Every hacker in the world knows him.
Simmons,Not just the hacker world. He infiltrated the Kremlin.
Fitz,"Yeah, the picture of, uh, Putin shirtless on horseback... that was his hack."
Ward,It was also his hack that got Chan kidnapped.
Coulson,"May, set a course for Austin."
May,Just did.
Skye,What about Chan?
Coulson,"Kwan's got a S.H.I.E.L.D. team on the ground. Our best bet is to chase this thing from the other end. Find Mr. Lydon, bring him in. See what he knows."
Skye,Just left the café where Miles logged in. Cashier says she hasn't seen him in over a week.
Ward,I may have eyes on him.
Ward,I've been made. Heading East on 5th street. Target is now in a silver Jetta.
Coulson,I got him.
Miles,"All right, suit. You asked for it. Gridlock protocol."
Coulson,I lost him.
Skye,You sure they're not following you?
Miles,"Yeah. Had to pull out all the stops, though. Thanks for the text. Wait, are you mad?"
Skye,Are you kidding me? I don't have much time. Who did you leak those files to?
Miles,"Wait a second. What? “Good to see you, too, Miles.” I released them into the world, where they belong."
Skye,They'll keep hunting you unless they have someone else to look for. And why the hell would you hack S.H.I.E.L.D.?
Miles,Because that's what we do.
Skye,"Not when I'm on the inside. You could have ruined everything, you dumbass."
Miles,Seems like you handled it.
Skye,I've come too far for you to... Why are looking at me like that?
Miles,Did you just call me “dumbass?”
Skye,Stop smiling. I'm serious.
Miles,"Because I taught you everything you know, so what does that make you?"
Skye,"No, you didn't."
Miles,I'm sorry. I can't help it. I've been missing you like crazy.
Miles,"That's where you keep that, huh?"
Skye,Better safe than busted.
Miles,Making any progress on that?
Skye,"I'm digging, but your little stunt is gonna make it harder. Where's my top?"
Miles,"You know, I could be helping you. If you send me ciphertext, I could be working on algorithms"
Skye,"No, I can't contact you. I never should have. There's a S.H.I.E.L.D. team looking for you right now... my team. And if they suspect something, I'm screwed."
Miles,There's a joke here that I'm resisting that involves the word “screwed.”
Skye,"Shut up. There's a guy in trouble because of you, and I got to get back. So if you want to help me, help me find my clothes."
Miles,"Hey. I'm sorry, Skye. Really, I am, if I messed anything up."
Skye,"I've missed you. Me, too. But we talked about this when I left for L.A. I've got a chance here. So S.H.I.E.L.D.'s off-limits, okay?"
Miles,"Okay. At least tell me what it's like. Come on, the belly of the beast."
Skye,Surprisingly... unbeastly. I've got good people I'm working with.
Miles,"Some good stories, though, I hope?"
Skye,Miles. You have no idea. But that's classified.
Miles,"You did not just say that to me! Come on, you got to tell me something."
Skye,Someday.
Miles,"Well, if they ever let you go on leave or whatever, let me know, and I'll get us a suite at the... fancy hotel that has suites, and you can regale me with stories while naked."
Skye,A suite? You? That's funny. But they're never gonna let me go on anything if I don't find my stupid... top.
May,Get. Dressed.
Skye,I know how this looks...
Coulson,How long have you two been in contact?
Skye,I contacted him once the day I joined to tell him I was okay and once earlier today.
Coulson,When you tipped off an active suspect?
Skye,"No, it's not like that. Miles and I... we met when we were both a little screwed up. Scratch that... he was a little screwed up, I was a lot. But we looked after one another. That's why I warned him, not because we're working together on this, but because we're... friends. I'm really sorry."
Coulson,"Noted. If not you, then who is Mr. Lydon working with?"
Skye,"No one. He's an idealist, believes in freedom of information."
Coulson,"That information cost a man his freedom, and you sabotaged our attempts to remedy that."
Skye,"No, I came here to find out what Miles knows about Chan."
Coulson,And?
Skye,Nothing. Miles is a dead end. He's harmless.
Coulson,We'll see.
Skye,"Really, I was gonna find out everything I could to try to help. I just... I felt like I couldn't tell you guys everything."
Coulson,I know. That's why I asked May to follow you. Seems like that wasn't a dead end.
Fitz,Why would Skye do this to us for him? I thought she was our friend.
Simmons,"I think she is, Fitz. But he's just obviously more than that."
Fitz,"Yeah, but we've been through so much together, and she didn't even tell us that she has a guy."
Simmons,"Well, who knows what they've been through together?"
May,The classified information you stole from us... who did you give it to?
Miles,It's information. It has a life of its own.
May,What happened to Mr. Chan?
Miles,"I don't know who that is, so why don't you tell me? So, are you guys just gonna destroy all my stuff?"
May,Yes.
Coulson,Anything?
Miles,I don't have to talk to you.
Coulson,Take him in. Gather all the evidence and secure the prisoners. We got what we were looking for here. We're going to Hong Kong.
Skye,"I'm so sorry, Ward. This is not what it looks like."
Ward,Hands. Now get up.
Simmons,"Uh, you missed a button."
Chan,"What is this big place, Raina? And who are these guys?"
Raina,"They'll assist you with anything you need. We're here to monitor your vitals while we observe your powers. And it's big because we'll need the space. This serum strengthens the cytoskeleton within each cell of your body. One dose, and you'll feel incredible... until it wears off."
Chan,And it will wear off?
Raina,"Yes. But the effects in average subjects have been impressive. In you, I'm excited to see."
Chan,What do you think of the name “Scorch?”
Raina,Breathe. Feel it? Now let's see what you can do.
Chan,"Whoa. Oh, sorry! You almost got scorched. This is incredible. Whoo! You are a beautiful angel, you know that?"
Raina,Your power is an amazing gift.
Chan,"And S.H.I.E.L.D. wouldn't let me use it. But thanks to you, the whole world can finally see what I can do. From now on, nobody holds me back."
Miles,"So, I guess due process isn't really S.H.I.E.L.D. protocol."
Skye,They don't have time for it.
Miles,"Whoa, are you defending them? These people are denying our basic rights."
Skye,This isn't about us. They're trying to save someone's life.
Miles,"Listen to yourself. That's what they always say to justify invading privacy, Skye. These people stand for everything we despise... secrets, censorship..."
Skye,"Enough with the manifesto, Miles."
Miles,"We can't let them get away with it! Manning, Snowden, Aaron Swartz... these are modern-day revolutionaries."
Skye,This has nothing to do with that. You leaked...
Ward,Guy's hiding behind platitudes. He's dirty. I can feel it.
Simmons,"Scrubbed clean, actually... nothing much on him. He's got no family records. His apartment's under an alias. And he plays a lot of Minecraft, where he runs a rather nasty mob."
Fitz,Is it... is it zombie?
Simmons,Zombie pigmen.
Ward,Keep looking.
Coulson,Go ahead. Say it.
May,I don't do petty.
Coulson,"But you called it. I trusted my gut, even though you said she was a risk."
May,"When someone breaks into my house, I usually don't invite them to stay, but that's me."
Coulson,"That was me, too. Then that alien staff went through my heart."
May,Sure it didn't go through the brain?
Coulson,"You really don't do comforting, either, do you?"
May,What is your gut telling you now?
Coulson,That she's still hiding something.
Simmons,"Sir, we found some evidence."
Ward,"She's been defending you, saying you're a stand-up guy. So I'm going to give you a chance. Do you want to tell her, or should I?"
Miles,I don't have to listen to you...
Ward,"There goes your chance. Your boyfriend here made a few deposits in the days following the leak. All said, it's about a million dollars."
Skye,What?
Ward,Real stand-up guy.
Miles,I can explain...
Skye,Did you sell information? Miles? Yes or no? Did you?!
Miles,"Yes, but..."
Skye,Ohh! You are so dead. What the hell were you thinking?!
Miles,It was a million dollars. A million dollars. It would change my life... our lives. And that woman was harmless. I looked into it.
Skye,No one with good intentions pays that kind of money for information! Did you ever think about that?!
Miles,Of course I did. I would never have done it if I thought...
Ward,Who is the woman you referred to?
Miles,"A fan of the Rising Tide, some rich girl in a flower dress. She knew all about me, said I had a gift. She thought people like us deserved more."
Skye,"Oh, you deserve more."
Miles,She pointed me to a Chinese S.H.I.E.L.D. feed... wanted me to crack it.
Ward,You thought that was harmless?
Skye,"I checked the data stream. It didn't seem like anything you and I hadn't already put out there, Skye. And I traced the account where the money came from to make sure it wasn't some evil corporation. It was just an eco-research lab. Otherwise, I would never..."
Ward,Ecological research?
Miles,"Yeah, insects, some study with centipedes. What's more harmless than that?"
Raina,It appears the volatility in the serum has been neutralized.
Debbie,I'm surprised you got him to cooperate.
Raina,He has dreams. I told him they'd come true.
Debbie,"You gave him a name, didn't you?"
Raina,Everyone wants to be remembered.
Raina,You were right. The platelets in his blood prevent the extremis in the serum from combusting.
Debbie,"That's fantastic. The others will be pleased. Good work, Raina. Now drain him. She walks out."
Coulson,It appears Centipede is responsible for Mr. Chan's kidnapping.
Ward,"First L.A., now Hong Kong. What kind of organization are we dealing with?"
Coulson,"International, well-financed, interested in creating a super soldier. Let's hope finding Mr. Chan will provide some answers. Using the account information Mr. Lydon gave us, S.H.I.E.L.D. H.Q. believes he's being held here."
May,Any ideas what Centipede wants with Chan?
Fitz,"Hard to say, but Simmons thinks that considering he's pyrokinetic..."
Simmons,There's a good chance his genetics could stabilize the extremis element of the Centipede serum.
Fitz,Keep their test subjects from going...
Simmons,Boom!
Coulson,"If Mr. Chan is Centipede's lab rat, we need to get there before the experiment's over."
Chan,This is no test. This is torture.
Debbie,Thank you for your participation. Our group really owes you one.
Chan,I won't let you. What have you done?
Debbie,"We don't understand what gave you this ability, but the reason you don't burn is because your blood platelets are fire-resistant."
Raina,Which is why we're removing them.
Debbie,Take this upstairs.
Chan,"Raina, you said I have a gift."
Raina,And you're giving it.
Chan,Raina! Raina!!!
Coulson,Agent May and I will be handling the field work. You stay and oversee the prisoners.
Ward,Sir? I was Skye's S.O. It was my responsibility...
Coulson,"It was my call to bring Skye onto the plane, and you warned me against it. My problem. I fix it."
Miles,I'm sorry. I honestly didn't know.
Skye,"All our talks... did you mean none of it? I risked everything to help you, and it turns out every word out of your mouth since we met is total crap!"
Miles,That's not true.
Skye,"Democratization of knowledge, “the truth will set you free.” The truth sure as hell came out."
Miles,"I believe in all those things. I just don't know why they have to go hand in hand with barely scraping by. Come on, Skye. You lived in your van for the last two years."
Skye,Now you're making fun of my van?
Miles,"I could have funded us for years... us. So you wouldn't have to sacrifice your principles, joining this corrupt institution to find what you're looking for. And what's wrong with me trying to do that?"
Skye,I'll tell you what's wrong with that. An innocent guy might die... for money.
Miles,"You know I'd never intentionally hurt anyone. I'm just trying to get my life together. At least you know what you're looking for. Me? I don't have that. For a long time, I thought it was you. I guess I was wrong."
Skye,I guess so.
Coulson,Building has five floors. The first four are research. Fifth is listed as maintenance but uses half the building's energy.
Kwan,Either they're guarding the world's largest vacuum...
Coulson,Or that's where Chan's being held. Send your “B” and “C” teams in through the tunnels to secure the lower floors. Warn them that the Centipede serum's highly explosive.
Kwan,Understood. Where do we go in?
Coulson,The roof.
May,There. Heat signature confirmed.
Coulson,I love these things.
Chan,Agent Kwan... it's you.
Kwan,We're here to get you out.
Coulson,"Strike team needs a security override, stat. Kwan, can you arrange... Chan, what have you done?"
Chan,I've set myself free.
Ward,Coulson's in trouble.
Chan,Aaaah!
Coulson,"Mr. Chan, I know you're in pain."
Chan,"This is nothing. You were the ones killing me, forcing me to keep this gift locked up inside."
Coulson,"So we're good, right?"
Skye,The entire facility's been locked down.
Fitz,Are you sure about this
Miles,This is pretty cool.
Skye,The alarms disconnected the system from all exterior servers.
Ward,Can you fix it or not?
Skye,"Yes, but you've got to get me on-site."
Miles,No way.
Ward,Not a chance.
Miles,"You're a hacker, Skye, not Seal team 6."
Skye,No. But he is.
May,His file say anything about him being homicidal?
Coulson,"Just said he was kind of a tool. Mr. Chan, believe it or not, this can still get worse."
Chan,"You bend someone long enough and they break. Poor little Chan Ho Yin may have believed your lies, but not Scorch."
May,Who?
Coulson,"Oh, crap. They gave him a name. Get me a clean look. I'll make sure he wakes up in a S.H.I.E.L.D. containment facility."
May,Waking is optional at this point.
Coulson,I'm out.
Chan,Nothing can stop me!
May,Where are we on the doors?
Ward,Almost there.
Debbie,"S.H.I.E.L.D. has infiltrated the building. No, it's under control."
Raina,Didn't want to tell them? Chan's true nature has revealed itself.
Debbie,"Without his platelets, the serum will combust."
Raina,Wouldn't be the first one to blow up on you. I'm beginning to think you're bad luck.
Ward,How long is this gonna take?
SKye,Done.
Coulson,Doors are unlocked. Where's Chan?
May,He's gone.
Coulson,Damn it.
May,That tranquilizer was his last chance. You know that.
Coulson,I know. It's time to minimize the damage. Simmons... are the building's computers back online?
Simmons,Yes.
Coulson,Uncuff Miles.
Chan,You!!!
Raina,I wish you all the best.
Debbie,"Please, look, we can fix you... make you stronger, take the name Scorch and make it mean something."
Chan,It already does.
Coulson,"Mr. Chan, we don't want to hurt you... but we have to. We gotta move!"
Simmons,You need to drive the blast into the main ventilation shaft.
Fitz,"Yeah, and on up to the roof."
Ward,"Skye managed to extract some files from the building's mainframe. It's not much, but could get us a fix on Centipede."
Coulson,Maybe.
Ward,"You can't save someone from themselves, sir."
Coulson,You can if you get to them early enough.
Coulson,"You've got two choices ... take what's in this box, or we put you in a slightly bigger one."
Miles,You want to give me a hint? What's it do?
Coulson,"Whatever we tell it to do. I'd try to avoid any unlawful activity, and I think you'll find it hard to use electronic devices for a while. You can go now."
Miles,"Cool, but we're still in Hong Kong."
Coulson,Yep.
Miles,"I live in Austin, Texas."
Coulson,"I know. Oh, and Agent Kwan's family thanks you for the anonymous donation. My office."
Miles,"So, you plan to stay?"
Skye,If they let me.
Miles,You've changed.
Skye,Good.
Miles,"I mean, you're not who you used to be."
Skye,And you're not who I thought you were.
Miles,I hope you find what you're looking for.
Ward,Make it a double.
May,Is there any other kind?
Skye,"So, I'm going to Coulson's office now. I figured you might want to be there, being my S.O. and all."
Ward,I'm off the clock.
Skye,"Right. Okay, then."
Skye,I didn't want anything to...
Coulson,"Stop lying. Since the moment you stepped foot on this plane, you've been lying to my face, to all of us."
Skye,"No, I haven't..."
Coulson,"You're lying now! I stood up for you to my team down there. And some of us started to believe in you, risked our lives for you."
Skye,I...
Coulson,"Why are you here?! You've been keeping something from us... this whole time. And it wasn't just a boyfriend. You have a secret, Skye, and one chance to come out with it. That's now, or I'm done with you."
Coulson,What is this?
Skye,It's everything I have.
Coulson,On us?
Skye,"On me. That's why I learned to crack systems, why I joined the Rising Tide... to find any details I could about my parents.  There's nothing. No records. There's no trace of them. My lifelong search has led to a single document... redacted."
Coulson,By S.H.I.E.L.D.
Skye,"No matter what you do, I'll never stop looking."
Coulson,You might not like what you find.
Skye,It can't be worse than what I've imagined.
Coulson,Maybe I can help.
Po,"Well, you know I'm not going to do the talking."
Raina,The doctor is dead.
Po,About time.
Raina,"Well, she did find a solution to our... combustion problem. We believe we'll soon have stable subjects. On to stage two."
Po,That mean my situation's going to improve any?
Raina,"Well, other problems have surfaced, resurfaced, I should say. The S.H.I.E.L.D. unit in Hong Kong, we've encountered them before. They... took our subject off the map in Los Angeles."
Po,Not much I can do about that in here. So that's not why I'm getting the visit.
Raina,We would like you to touch base with the Clairvoyant. See if any insights can be given... on stage three.
Po,The Clairvoyant doesn't like to be touched.
Raina,We all have to do things that make us uncomfortable if we are ever to get our toy soldiers off the shelf. You know that better than any of us.
