character,line
Skye,"No, everything's my fault. You're right. There's something very wrong with me."
Fitz,"No, you're just different now. You're just different now, and there's nothing wrong with that."
Man,Don't move. We're not here to hurt you. We just want to take you in.
Raina,No. Either you kill me... or I make you do it.
Gordon,"It's okay, beautiful. I'll show you the way."
Hunter,Or that time when Trip tossed me the mag on the burnside raid and it fell down the sewer grate.
May,"Yeah, what did he say again?"
Hunter,"“Good catch, soccer hands.”"
Simmons,Did he ever tell you about the time his grandpa took him to grandfather mountain when he was a child in North Carolina?
Skye,Mnh-mnh.
Simmons,"Well, he gets there, and they pull up to the gate..."
Mack,I have visual confirmation. Fury's toolbox is locked in Coulson's office.
Morse,Did you manage to wrangle the blueprints from the base?
Mack,"Yeah, we're almost good to go."
Morse,"Okay, I'll make contact soon."
Simmons,"And he says, “I'm sorry, grandpa. I thought you owned the whole mountain.” He'd be mad I told you that story."
Skye,"No, he'd say..."
All,"“Come on, girl.”"
Skye,We're gonna laugh a lot less... that's for sure.
