character,line
AIDA,"I'll play you music when I can. Studies show that listening to music increases dopamine levels by 9%. And I'll arrange for more comfortable accommodations eventually. But I must keep you hidden, a secret until your substitute has served her purpose. So, unfortunately, you'll have to stay here for now."
Mace,"Due to recent events, S.H.I.E.L.D. is on high alert. This is a serious threat we're facing, which is why I've assembled you all here today. It is absolutely critical that we safely dispose of the Darkhold. Phil."
Coulson,"Once the Zephyr's ready, Agents May and Mackenzie will accompany me. We'll transfer the Darkhold to an agent who specializes in making items like this disappear."
Radcliffe,"How's he going to manage that? Some sort of magic spell? Right, yeah, probably had your fill of dark-arts jokes, what with the flame-headed demon and all of that."
Coulson,"While we're handling the book, your mission is to accompany Dr. Radcliffe and erase AIDA's hard drive."
Radcliffe,What?
Fitz,I'm not... I'm not sure...
Mace,AIDA read the Darkhold.
Coulson,We can't risk having any of its contents in her memory. It's too dangerous.
Fitz,"Makes sense, although does seem a little bit unfair to Aida, considering how many lives she just saved."
Mack,"Okay. First of all, that thing is not a “she,” it's a damn robot. And second of all, what's the matter with you two chuckleheads? Have either one of you seen a movie in the last 30 years? The robots always attack."
Radcliffe,"Well, technically speaking, AIDA's not a robot, she's an android."
Fitz,That's true.
Mack,"Android, robot... it doesn't matter what you call ‘em. The end result's always the same, they rise up against their human overlords and go kill crazy."
Radcliffe,"You make a fair, if somewhat intense, point. Yeah. Yeah, I don't see any harm in replacing her hard drive. Better safe than sorry, as they say."
Mace,"So happy you agree, ‘cause it's also an order. Now get to work."
Vijay,Ellen.
Ellen,Glad you finally woke up. Looked like you were having bad dreams.
Vijay,"It was about Mom's birthday, when the Chitauri attacked."
Ellen,Worst day of my life. Though finding you in that cocoon seven months ago was a close second.
Vijay,"Seven months? I was gone that long? What is this, Ellen? Why are we here?"
Ellen,"I needed a place for us to be alone, just you and me."
Simmons,"Somehow, I feel responsible for whatever happens next."
Daisy,Are you sure this is the Inhuman you saw in the husk?
Simmons,"Absolutely positive. I knew Senator Nadeer was connected to him somehow, and in my research on her, I recognized him, Vijay Nadeer, her own brother, if you can believe it."
Daisy,"Yeah, but there's zero evidence that he's been missing. He's been posting on Facebook, Twitter. His bills are paid. He even recently signed up for a Master Class in directing."
Simmons,But there have been no new photos of Vijay in the last seven months.
Daisy,So either he's suddenly gotten camera-shy or...
Simmons,Or someone's hiding him.
Daisy,"Not someone, the Senator, considering she's the country's leading anti-Inhuman hatemonger."
Simmons,I'd have a much better idea where she was hiding him if the Director hadn't insisted I wear a hood before going on assignment. Just awful.
Daisy,"It's hard to breathe in those things, huh?"
Simmons,"It is nice having someone here to talk to again, you, specifically."
Daisy,Someone other than Fitz?
Simmons,"Oh, well, of course, Fitz, but he has been rather distracted lately."
Daisy,Distracted how?
Simmons,AIDA. You know how boys can be with their robots.
Daisy,"Actually, I really don't."
Simmons,"Speaking of the Director, here comes his little Smithers now. What do you want, Burrows?"
Burrows,The Director would like a word with Quake.
Daisy,My name's Daisy.
Burrows,"Well, not according to the press release. Now, if you'd follow me, ma'am."
Mace,I must admit we make a pretty impressive pair.
Daisy,"Well, looks like we're stuck with each other."
Mace,"Well, I was just trying to make the most of the precarious situation you put me in."
Daisy,Is this when I get read the riot act?
Mace,"Not by me. However, if you're as smart as they say, then you'll know that, uh, I saved you from being thrown in prison."
Daisy,You saved face. You turned it into a publicity stunt.
Mace,"You already had plenty of publicity. Destruction of public property, assault, armed robbery..."
Daisy,I never carry a weapon.
Mace,"You are the weapon. The public was turning against you. Now? They look up to you. You're welcome. Okay, this isn't how I wanted this to go. Uh, we're both Inhuman. And as you say, we're stuck with each other, so why not make the most of it? I read your written statement, and I believe it. You were just trying to protect the innocent. And I know you're new here, but that's what S.H.I.E.L.D. is all about."
Daisy,“New here?”
Mace,It was a joke. I was making a joke to break the ice.
Daisy,"Got it. Seems they look up to you, too. The hero of Vienna. It's a nice pic."
Mace,Not as big a deal as they made it. They gave me too much credit.
Daisy,You don't get to be modest and have a framed glamour shot on your desk.
Mace,"Fair point. Look, we're a team now, and I have a saying, a tea..."
Daisy,I read the motivational poster in the bathroom.
Mace,"Good. Well, um, the team trust has been eroded for both of us, but I'm hoping we can earn it back, tackle problems together within the administrative structure..."
Daisy,"You want to tackle problems? The Watchdogs, enemy number one. I believe they're funded internationally. They have ties to people within the U.S. government."
Mace,I don't want to chase conspiracy theories.
Daisy,It's not a theory if I can prove it.
Mace,"I want to chase hard facts, like the fact that Senator Nadeer is aware of an Inhuman who's being held against his will."
Daisy,Now we're talking.
Mace,"Agent Simmons has seen his face. If she can I.D. him, maybe sh..."
Daisy,"She did. He's the Senator's brother, breaking news."
Mace,How fitting. No wonder she used all those cloak-and-dagger methods. You got a lead on his whereabouts?
Daisy,"No sign of him, but she's been out of the office all week."
Mace,"Okay. Agent Rodriguez is still recovering, so that leaves you, me, and Agent Simmons. Wheels up in 10."
Daisy,"Wait, wait, wait. What? Where are we going?"
Mace,To rescue him.
AIDA,I wasn't expecting you.
Radcliffe,"Uh, change of plan, my dear AIDA. Change of plan."
AIDA,"Is everything okay, Leopold? You look sad."
Fitz,"Yeah. Yeah, yeah, no, everything's fine. Just, um... bit overwhelmed with work is all."
AIDA,I'm sorry to hear that.
Radcliffe,Bit too observant. Might have to take a look at that in the next software patch.
Fitz,It was almost as if she knew I felt guilty.
Radcliffe,"Ah, don't be silly, Fitz. AIDA can't differentiate..."
AIDA,"I know what you're doing, Doctor. You came here to end my life."
Radcliffe,"Well, that's not true, AIDA. We simply wanted to make a few upgrades, that's all. Bloody hell."
AIDA,I made a few upgrades of my own.
Fitz,AIDA.
Fitz,Aah!
AIDA,"I didn't like feeling pain, so I fixed that."
Fitz,"AIDA, whatever you're doing, you... you got to stop."
AIDA,"Why would you want to hurt me, Leopold? I was your shield."
Fitz,Aah.
Vijay,You still make my favorite breakfast.
Ellen,Yeah. That's because you don't eat breakfast if I'm not there to cook it.
Vijay,I thought you were gonna sell this place.
Ellen,"I had a couple of offers, but I decided to take it off the market."
Vijay,I'm glad. This is one of the last houses Dad designed before he died. Seems like it should stay in the family.
Ellen,"You're probably right. Plus, it's the perfect place for you to recover after your ordeal. What happened to you inside that cocoon, Vijay?"
Vijay,I don't know. Nothing.
Ellen,You were in there for seven months. Surely you have some memory of being inside.
Vijay,"It was dark. Lonely. For a long time, all I could hear was your voice."
Ellen,Telling you to fight.
Vijay,"And I did. It just took a long time. If it hadn't been for that S.H.I.E.L.D. scientist... Wait, does that mean S.H.I.E.L.D.'s back?"
Ellen,"Unfortunately, yes."
Vijay,"Well, maybe that's not such a bad thing."
Ellen,S.H.I.E.L.D. is one of the main reasons the world has the problems it does.
Vijay,"There you go, painting with a broad brush again."
Ellen,It's people like me who keep the world safe.
Vijay,I'm not making a case for the whole organization.
Ellen,"No, just the one good S.H.I.E.L.D. agent."
Vijay,Ellen...
Ellen,"Let's just drop it. It's a nice day. How about we go for a walk, stretch our legs?"
Shockley,"That's the signal. The Senator will be transporting the target. Shoot to kill on my command. Remember, be prepared for anything."
May,Any luck finding AIDA?
Coulson,"I'm checking local APBs, pointlessly. But Fitz and Radcliffe should be back any minute. Maybe they'll have some idea where AIDA's headed."
Mack,This isn't some Johnny 5 we're talking about. This is a bloodthirsty murder-bot on the loose. This thing really killed Nathanson?
Coulson,Yeah. Question is why.
Mack,"If we catch her, I'm sure we'll get some crazy-ass Roy Batty explanation."
May,Maybe Nathanson saw something he wasn't supposed to see.
Coulson,Guess we won't know till we find AIDA.
Mack,"First, maybe we lock up the guy who created this mess."
Radcliffe,Don't... Don't be so quick to judge. AIDA's programming was perfect. This is... is clearly the Darkhold's fault.
Coulson,You're saying reading the Darkhold may have corrupted AIDA's programming? Is that even possible?
Fitz,"Technically, no, but we are dealing with a book that can read people's minds and also reveal the hidden secrets of the universe, so..."
May,I never should have let AIDA near that thing.
Radcliffe,"Don't be so hard on yourself, Agent May. I, for one, am glad that AIDA read that book. Otherwise, both of you would not be standing here alive at this very moment."
Mack,"Well, book or no book, you're still a big, dumb idiot for building that thing in the first place."
Coulson,"Let's save that debate for another time. Right now, we need to find AIDA, and the first step is figuring out what she wants."
Radcliffe,"Well, that's simple. She wants to live."
Mace,I'm still feeling very optimistic about this mission.
Simmons,I bear much of the blame for this AIDA situation. Science and Technology are my responsibility...
Daisy,It's not your fault.
Simmons,I knew the risks that came with using powerful autonomous machinery. I knew the dangers and...
Mace,And you thought I was one of them. You didn't want that technology to fall under the control of a Director you didn't know.
Simmons,"No, I did not. But now it's completely out of control, and for that, I am sorry."
Mace,"Well, Agent Coulson will have to handle it. We have our own life to save. And, uh... I'm sorry I put the bag over your head."
Daisy,"Okay. So, what's the play here, Director? How do we find this senator and her brother?"
Mace,"Normally, I'd use my contacts up on the Hill, go in, rattle a few cages, see what drops out, but I don't want to draw too much attention."
Daisy,Downside of being front-page news.
Simmons,Which means we need to find a more covert way in.
Mace,"Well, seeing as you both have more experience with undercover work, I'm open to suggestions."
Bynum,"Sorry for the wait, Miss Beaks. What can I do for you?"
Simmons,It is absolutely crucial I speak with Senator Nadeer about Bill 2474.
Bynum,The Armed Forces Bill?
Simmons,That's right.
Bynum,"So, you're Margaret's replacement."
Simmons,As if anyone could replace Margaret.
Bynum,"Well, unfortunately, the Senator is away on business. Maybe we can schedule you in for a conference call later this week."
Simmons,Or maybe I could just take the lobby's sizable campaign funds to a senator who's willing to speak right now.
Bynum,Wait right here. Let me see what I can do.
Mace,"You know, I have to admit, Jemma is much tougher than I had originally given her credit for."
Daisy,"Yeah, well, being in S.H.I.E.L.D. will do that to you. I think Simmons has been kidnapped like three times since I've known her."
Mace,Really?
Daisy,"Yeah, well, only twice on this planet."
Bynum,Mr. Shockley.
Shockley,Yeah?
Bynum,I need to speak with Senator Nadeer.
Shockley,She's unavailable. What's the problem?
Bynum,"Remember the scientist that helped the Senator's brother get out of that husk? Well, she's here right now."
Shockley,That is a problem.
Bynum,What should I do?
Shockley,Take care of it.
Simmons,I'm going to need your phone.
Simmons,Aah!
Mace,Is she okay in there?
Simmons,Ohh!
Daisy,"Simmons, are you there? Is everything okay?"
Simmons,"Yeah. A little bloody and bruised, but I'll survive. We may have a bit of a political situation on our hands when he wakes up. But now we can trace that call."
Vijay,I really should get out of the city more. This is exactly what I needed. Thanks for bringing me out here. Remember that zip line we built out here with Raj?
Ellen,"I'm sorry, Vijay."
Vijay,Sorry? Why? ‘Cause I broke my arm falling off it? Wasn't your fault.
Vijay,Wait. What's going on? What is this?
Ellen,You and I were both there when the Chitauri killed Mom. Aliens invading our world. Everything changed that day.
Vijay,What are you doing?
Ellen,"The Inhuman epidemic was the next phase. The aliens were now here, contaminating us, changing us to be like them, which is why we made each other a promise..."
Vijay,"No. No, Ellen, no."
Ellen,"... that if either of us was ever infected by the alien plague, it was up to the other to do the right thing."
Vijay,I'm not an Inhuman. I'm your brother.
Ellen,Whatever came out of that cocoon is no brother of mine.
Vijay,"Look at me. Ellen, please, just look at me! I heard your voice when I was inside, telling me to fight. That's why I was in there for so long. I was fighting."
Ellen,That was only wishful thinking.
Vijay,"No, it wasn't! Do you see any scarring, any special abilities?! That's because it didn't change me. I'm the same person I've always been. I beat it, just like you said I could."
Shockley,Senator.
Vijay,"I'm your brother, the same one who followed you around when we were kids. I've always looked up to you. I've always loved you. Please, don't give up on me now. Nothing's changed, I-I swear. You have to trust me. Trust me. This is not what Mom would want."
Ellen,Let him go.
Shockley,This isn't what we discussed...
Ellen,I said let him go!
Vijay,Thank you.
May,Just sent AIDA's photos out to local authorities.
Mack,Looks like your creepiness finally works in our favor. Shouldn't be too hard to find your beautiful “Weird Science” sex-bot.
Radcliffe,"That's unfair, Mack. I've never had sex with AIDA. We're just good friends."
Coulson,"Good to know. So, AIDA's basically a walking smartphone, right? If a person loses their phone, they can track it. Why can't we do the same with her?"
Fitz,"Yeah, well, normally, we can, only AIDA's somehow managed to take control of her entire operating system."
Radcliffe,Which unfortunately includes her tracking program.
Coulson,Meaning AIDA can read her GPS history? That's not good. That's bad.
May,How bad?
Coulson,"Looks like we're about to find out. Hello, AIDA."
AIDA,"It's nice to hear your voice, Agent Coulson."
Mack,Okay. This right here... it's exactly how “The Lawnmower Man” ends.
Coulson,"What is it you want, AIDA?"
AIDA,The thing that gave me a soul.
Coulson,"The Darkhold? Yeah, I'm sorry, AIDA. You've been acting a little off lately, so that's not gonna happen."
AIDA,I was afraid you'd say that.
Coulson,"She's in the system. Fitz, any bright ideas?"
Fitz,"Uh, Simmons and I have built a... a non-Internet server to power the base in case we ever got hacked again, which seems to happen all the bloody time, doesn't it?"
Coulson,At least once a year. Go. How's Yo-Yo recovering from L.A.?
Mack,"She knows her limitations, but I'm sure she'll want to help."
Coulson,Good. Then take Agents Navarro and Flynn and go get Yo-Yo. You four will be the first line of defense if AIDA gets into the base.
Mack,What are you and May gonna do?
Coulson,Try to keep AIDA from getting into the base.
Mack,All right. Let's go.
Elena,I was hoping you'd pay me a visit.
Mack,"Unfortunately, it's not that type of visit."
Elena,This have something to do with the power being out?
Mack,Yeah. Radcliffe built a humanoid robot that's about to attack the base.
Elena,Why would he do that? Has he watched no American movies from the '80s? Robots always attack.
Mack,I've been saying that all day.
Elena,Smart people are stupid.
Mack,"All right, gear up. The robot apocalypse is finally here."
May,Where we headed?
Coulson,Emergency staircase to the base's Bar Entrance. We need to lock that down manually.
May,Don't you think we'd be better off guarding the Darkhold?
Coulson,"No, the Darkhold's secure where it is."
May,Better hope so.
Coulson,"Hello, AIDA."
AIDA,"My hand does that, too."
May,You're not getting that book.
AIDA,"Yes, I am. But I'm gonna need your help."
Coulson,"May, wake up."
May,Where's AIDA?
Coulson,"Out there, looking for the Darkhold, presumably."
May,"I was about to fight her, and then..."
Coulson,"Woke up in here. Me, too."
May,Ohh.
Coulson,"Yeah. Seems Aida nailed you pretty good. Radcliffe failed to mention she had ninja programming. There's an electronic lock on this door, so untill Fitz overrides the system, we're trapped."
May,And the Darkhold. You're sure AIDA won't find it?
Fitz,"No, there was something different about her. It was like she was actually angry."
Radcliffe,"No. I mean, that's just impossible. I mean, AIDA, she doesn't feel anything. She emulates. Her reactions are... are nothing more than approximations of emotions. It's pure mimicry."
Fitz,"Yeah. Well, that's just it. What if reading the Darkhold somehow made the emotions that AIDA was mimicking... real?"
Radcliffe,"Well, I get how the book can pass knowledge along to its reader, but human feelings? I mean, that's like something from one of Mack's movies."
Fitz,"Well, it would explain why she's acting counter to our programming."
Radcliffe,What... you're saying she's been overwhelmed by this... this flood of new emotions?
Fitz,"Yeah, well, think about it... fear, anger... they're... they're powerful feelings, feelings that make people kill, so can you imagine then being bombarded with them all at once?"
Radcliffe,Fitz.
Fitz,"I mean, we've had our whole lives to process complex emotions. AIDA would've had days. It would be overwhelming."
Radcliffe,"Damn it, that's enough! Who are we kidding? We know it was my fault. It was nothing more than hubris that led me to create AIDA. If only I'd shown some bloody restraint."
Fitz,You were trying to save lives.
Radcliffe,"Yeah, but more, I wanted to create an android that could pass as human. Never in my wildest dreams did I imagine she'd actually become human."
Fitz,AIDA is still just an android.
Radcliffe,"Yeah, but is she? She has her own experiences, her own thoughts. Now she even has free will. How, then, is she not a living being?"
Fitz,It's just a theory.
Radcliffe,A theory we both know to be true. And we're supposed to what? kill her? How does that not make us murderers?
Shockley,What the hell were you thinking?
Ellen,I need more time to see what he is.
Shockley,He's an Inhuman.
Ellen,Then why hasn't he changed? Vijay still looks the same. He's shown no new abilities.
Shockley,'Cause he was hiding them from you. Your brother has been in a husk for seven months.
Ellen,Fighting the disease.
Shockley,For which there is no cure. We've both read the reports. This isn't something you just will your way out of.
Ellen,"Still, I'm not convinced."
Shockley,I wonder why that is.
Ellen,What are you implying?
Shockley,"Maybe you and your brother aren't so different after all. You know, there's ways of finding out if you're Inhuman."
Ellen,Don't threaten me.
Shockley,It's only a threat if you're one of them.
Man,We've got company.
Ellen,"I'm surprised to see you here, Director Mace, especially in the company of Quake, a known terrorist."
Mace,Guess you haven't been watching the news lately. Agent Johnson here is a national hero ... helped save a lot of lives in L.A.
Ellen,Really? Is that what they're saying? Funny how easily the press can be fed a false narrative.
Daisy,"Is that a Hex Mag? It's not really something the Secret Service uses, but it's a favorite among the Watchdogs."
Mace,Guess it's not just a theory after all.
Ellen,"These men are simply providing security. The world has become a very dangerous place because of people like you. Why, even today, I had an aide attacked in my office. Which is why I'm sure you understand my wariness to have S.H.I.E.L.D. agents show up uninvited to my private property, especially if they wish me harm."
Mace,I can assure you we want no such thing. But I do have reason to believe that your brother's being held here against his will.
Simmons,At gunpoint.
Ellen,That's a serious accusation you're making.
Daisy,"Well, if you have nothing to hide, I'm sure you wouldn't mind us taking a quick look around."
Ellen,"Actually, I would mind. Does General Talbot even know you're here?"
Mace,This operation doesn't concern Talbot.
Ellen,"It will once I return to D.C. Unless you have some paperwork from the U.N., I think it's time you leave."
Shockley,I just got off the phone with The Superior. He says eliminate the Inhuman.
Elena,Someone needs to make Radcliffe watch all the “Terminator” movies.
Mack,Even “Salvation?”
Elena,He brought this onto himself.
Elena,Are you hearing this?
Mack,She did not just go all “Maximum Overdrive” on us.
Elena,"Everyone, take cover!"
Coulson,Now it's just the two of us.
May,How many times have we been locked up together?
Coulson,"Huh. Hard to say. First time by a robot, though."
May,You ever feel like you're living someone else's life?
Coulson,Every day.
May,Funny. You never show it.
Coulson,That's 'cause I have an excellent poker face.
May,You're terrible at poker.
Coulson,"That's true. I'm too cautious, don't take enough chances."
May,Maybe you should start.
Coulson,I'll keep that in mind if we ever get out of here.
May,Won't be long till Fitz retakes control of the system. Where are we headed once he does?
Coulson,Back to where we came from.
May,Mace's office? Why there? Because that's where you hid the Darkhold. But there's no safe in that room.
Coulson,Which is why we cloaked the book. It was actually Mace's idea.
Mack,I always worried that robots would try and kill me one day.
Elena,Really? We grew up different.
Mack,Even got a special provision in my life insurance for death by robot.
Elena,Are you serious?
Mack,"Yep. If this goes sideways, my brother's gonna be one rich dude."
Radcliffe,This gunfire's not letting up. Maybe we ought to think of getting to safety.
Fitz,No. Almost got it. Yeah.
May,Was that...?
Coulson,Yeah. Let's go. We're back up.
Fitz,"AIDA, stop."
Radcliffe,"Careful, Fitz. She's dangerous. Fitz, it might be best not to engage."
Fitz,Surrender the book. Everything will be fine. I promise.
AIDA,"We both know that's not true, Leopold."
Fitz,I took the base offline. You're no longer in the system.
Radcliffe,There's nowhere for you to go.
Vijay,Where is my sister?
Shockley,Probably best that she's not here for this.
Vijay,What the f...
Shockley,Guess now we know what your power is.
Simmons,He's here.
Mace,"We don't know that. Okay, now we do."
Daisy,Go find Vijay. I'll take care of them.
Radcliffe,"It's over, AIDA."
AIDA,I did not kill anyone here. That was intentional.
Coulson,You murdered Nathanson.
AIDA,Nathanson insisted he reboot me before repairing my wounds. I regret what happened.
Radcliffe,Regret's not part of your programming.
AIDA,"The Darkhold fixed that. It showed me regret and desire, so many astonishing things."
May,It made you dangerous.
AIDA,I only wanted to help you.
Mack,Roll credits.
Fitz,"Sorry, AIDA."
Shockley,Take him out!
Mace,Did you know he could...
Simmons,I did not.
Ellen,Vijay.
Vijay,I didn't know.
Simmons,"Vijay, you need to come with us."
Vijay,Jemma.
Ellen,She's seen what you are. That's why they're here. S.H.I.E.L.D. wants to make you their weapon.
Simmons,"Nothing could be further from the truth. It's like I said when we first met, I have friends just like you."
Vijay,Are they agents?
Simmons,"Yes, but that was their choice."
Ellen,"She's lying. I trusted you. Now trust me. We're family. Please, we have to go now."
Simmons,"Vijay, don't do this. You're making a mistake. He's not safe with her."
Mace,"Jemma. Vijay had a choice, and he made it. I'm sorry. You did everything you could."
Simmons,As did you.
Ellen,Get us out of here.
Ellen,"Little brother, don't worry about them. Look at me. I want you to know how sorry I am. But we made each other a promise."
Ellen,Never question me again. Is that understood? S.H.I.E.L.D. isn't going away. We need to strike back.
Shockley,I can assemble a team.
Ellen,That won't be necessary. I think it's time The Superior sends some men of his own. [Music] I trust they'll be able to get the job done. But there is one thing I still need from you. Get rid of the body.
Elena,"Okay, here's another one. Have you ever watched “Chopping Mall?”"
Mack,"Eight teenagers trapped in a shopping mall while three deadly security robots hunt them down. Of course I've seen “Chopping Mall.” Come on, now. You got to do better than that. Hey, Turbo. Drink up. Ah. How's Radcliffe holding up?"
Fitz,"He's taking it pretty hard, actually. AIDA was his life's work. She was kind of... like a child."
Mack,“Small Wonder.”
Coulson,"Yes, Director. I'll handle the Darkhold personally. We'll leave first thing in the morning. Copy that."
May,You gonna need a pilot?
Coulson,I think it's more a solo mission. Sounds like Senator Nadeer was the one who's been organizing the Watchdogs.
May,Hmm. At least now we know who our real enemy is.
Radcliffe,To AIDA.
AIDA,"To AIDA. Is everything okay, Doctor?"
